{
  "$schema": "http://json-schema.org/draft-07/schema#",
  "title": "Municipal councillor list (v1.2)",
  "type": "array",
  "items": {
    "type": "object",
    "required": ["氏名", "登録名", "よみ", "X（旧Twitter）", "所属"],
    "properties": {
      "氏名": { 
        "type": "string",
        "description": "議員の氏名（姓と名の間に全角スペース）"
      },
      "登録名": { 
        "type": "string",
        "description": "正式な登録名（通常は氏名と同じ）"
      },
      "よみ": { 
        "type": "string",
        "description": "ひらがなの読み仮名（姓と名の間に全角スペース）"
      },
      "X（旧Twitter）": { 
        "type": ["string", "null"], 
        "format": "uri",
        "pattern": "^https://x\\.com/[a-zA-Z0-9_]+$|^null$",
        "description": "X（旧Twitter）のURL、またはnull"
      },
      "所属": { 
        "type": "string",
        "description": "所属会派名（無所属の場合は「無所属」）"
      }
    },
    "additionalProperties": false
  }
}