[
  {
    "氏名": "関口　えり子",
    "登録名": "関口　えり子",
    "よみ": "せきぐち　えりこ",
    "X（旧Twitter）": "https://x.com/sekiguchieriko5",
    "所属": "日本共産党あきる野市議団"
  },
  {
    "氏名": "辻　よし子",
    "登録名": "辻　よし子",
    "よみ": "つじ　よしこ",
    "X（旧Twitter）": null,
    "所属": "くさしぎ"
  },
  {
    "氏名": "しょうじ　さとし",
    "登録名": "しょうじ　さとし",
    "よみ": "しょうじ　さとし",
    "X（旧Twitter）": null,
    "所属": "リメンバー"
  },
  {
    "氏名": "国松　まさき",
    "登録名": "国松　まさき",
    "よみ": "くにまつ　まさき",
    "X（旧Twitter）": null,
    "所属": "自由民主党志清会"
  },
  {
    "氏名": "原田　ひろこ",
    "登録名": "原田　ひろこ",
    "よみ": "はらだ　ひろこ",
    "X（旧Twitter）": null,
    "所属": "公明党"
  },
  {
    "氏名": "大久保　昌代",
    "登録名": "大久保　昌代",
    "よみ": "おおくぼ　まさよ",
    "X（旧Twitter）": null,
    "所属": "公明党"
  },
  {
    "氏名": "松本　ゆき子",
    "登録名": "松本　ゆき子",
    "よみ": "まつもと　ゆきこ",
    "X（旧Twitter）": null,
    "所属": "日本共産党あきる野市議団"
  },
  {
    "氏名": "中村　のりひと",
    "登録名": "中村　のりひと",
    "よみ": "なかむら　のりひと",
    "X（旧Twitter）": "https://x.com/norihito0623",
    "所属": "明るい未来を創る会"
  },
  {
    "氏名": "よしざわ　ゆたか",
    "登録名": "よしざわ　ゆたか",
    "よみ": "よしざわ　ゆたか",
    "X（旧Twitter）": null,
    "所属": "自由民主党志清会"
  },
  {
    "氏名": "浦野　治光",
    "登録名": "浦野　治光",
    "よみ": "うらの　はるみつ",
    "X（旧Twitter）": null,
    "所属": "自由民主党志清会"
  },
  {
    "氏名": "中村　一広",
    "登録名": "中村　一広",
    "よみ": "なかむら　かずひろ",
    "X（旧Twitter）": null,
    "所属": "自由民主党志清会"
  },
  {
    "氏名": "ひはら　省吾",
    "登録名": "ひはら　省吾",
    "よみ": "ひはら　しょうご",
    "X（旧Twitter）": null,
    "所属": "自由民主党志清会"
  },
  {
    "氏名": "窪島　成一",
    "登録名": "窪島　成一",
    "よみ": "くぼしま　せいいち",
    "X（旧Twitter）": null,
    "所属": "自由民主党志清会"
  },
  {
    "氏名": "増﨑　俊宏",
    "登録名": "増﨑　俊宏",
    "よみ": "ますざき　としひろ",
    "X（旧Twitter）": null,
    "所属": "公明党"
  },
  {
    "氏名": "たばた　あずみ",
    "登録名": "たばた　あずみ",
    "よみ": "たばた　あずみ",
    "X（旧Twitter）": null,
    "所属": "日本共産党あきる野市議団"
  },
  {
    "氏名": "清水　晃",
    "登録名": "清水　晃",
    "よみ": "しみず　あきら",
    "X（旧Twitter）": null,
    "所属": "明るい未来を創る会"
  },
  {
    "氏名": "村野　栄一",
    "登録名": "村野　栄一",
    "よみ": "むらの　えいいち",
    "X（旧Twitter）": null,
    "所属": "自由民主党志清会"
  },
  {
    "氏名": "天野　正昭",
    "登録名": "天野　正昭",
    "よみ": "あまの　まさあき",
    "X（旧Twitter）": null,
    "所属": "自由民主党志清会"
  },
  {
    "氏名": "子籠　敏人",
    "登録名": "子籠　敏人",
    "よみ": "こごもり　としひと",
    "X（旧Twitter）": null,
    "所属": "自由民主党志清会"
  },
  {
    "氏名": "堀江　武史",
    "登録名": "堀江　武史",
    "よみ": "ほりえ　たけし",
    "X（旧Twitter）": null,
    "所属": "自由民主党志清会"
  },
  {
    "氏名": "臼井　建",
    "登録名": "臼井　建",
    "よみ": "うすい　けん",
    "X（旧Twitter）": null,
    "所属": "自由民主党志清会"
  }
]