[
  {
    "氏名": "川名　ゆうじ",
    "登録名": "川名　ゆうじ",
    "よみ": "かわな ゆうじ",
    "X（旧Twitter）": "https://x.com/kawanayuji",
    "所属": "立憲民主ネット"
  },
  {
    "氏名": "蔵野　恵美子",
    "登録名": "蔵野　恵美子",
    "よみ": "くらの えみこ",
    "X（旧Twitter）": null,
    "所属": "立憲民主ネット"
  },
  {
    "氏名": "菅　源太郎",
    "登録名": "菅　源太郎",
    "よみ": "かん げんたろう",
    "X（旧Twitter）": "https://x.com/kangentaro",
    "所属": "立憲民主ネット"
  },
  {
    "氏名": "藪原　太郎",
    "登録名": "藪原　太郎",
    "よみ": "やぶはら たろう",
    "X（旧Twitter）": "https://x.com/t_yabuhara",
    "所属": "立憲民主ネット"
  },
  {
    "氏名": "西園寺　みきこ",
    "登録名": "西園寺　みきこ",
    "よみ": "さいおんじ みきこ",
    "X（旧Twitter）": null,
    "所属": "立憲民主ネット"
  },
  {
    "氏名": "深沢　達也",
    "登録名": "深沢　達也",
    "よみ": "ふかざわ たつや",
    "X（旧Twitter）": null,
    "所属": "立憲民主ネット"
  },
  {
    "氏名": "与座　武",
    "登録名": "与座　武",
    "よみ": "よざ たけし",
    "X（旧Twitter）": null,
    "所属": "自由民主・市民クラブ"
  },
  {
    "氏名": "道場　ひでのり",
    "登録名": "道場　ひでのり",
    "よみ": "みちば ひでのり",
    "X（旧Twitter）": null,
    "所属": "自由民主・市民クラブ"
  },
  {
    "氏名": "きくち　由美子",
    "登録名": "きくち　由美子",
    "よみ": "きくち ゆみこ",
    "X（旧Twitter）": null,
    "所属": "自由民主・市民クラブ"
  },
  {
    "氏名": "木崎　剛",
    "登録名": "木崎　剛",
    "よみ": "きざき つよし",
    "X（旧Twitter）": null,
    "所属": "自由民主・市民クラブ"
  },
  {
    "氏名": "山崎　たかし",
    "登録名": "山崎　たかし",
    "よみ": "やまざき たかし",
    "X（旧Twitter）": "https://x.com/yamazakimusashi",
    "所属": "自由民主・市民クラブ"
  },
  {
    "氏名": "浜田　けい子",
    "登録名": "浜田　けい子",
    "よみ": "はまだ けいこ",
    "X（旧Twitter）": "https://x.com/hamadakeikogo1",
    "所属": "市議会公明党"
  },
  {
    "氏名": "大野　あつ子",
    "登録名": "大野　あつ子",
    "よみ": "おおの あつこ",
    "X（旧Twitter）": "https://x.com/ohnoatsuko",
    "所属": "市議会公明党"
  },
  {
    "氏名": "落合　勝利",
    "登録名": "落合　勝利",
    "よみ": "おちあい しょうり",
    "X（旧Twitter）": "https://x.com/OchiaiShori",
    "所属": "市議会公明党"
  },
  {
    "氏名": "本間　まさよ",
    "登録名": "本間　まさよ",
    "よみ": "ほんま まさよ",
    "X（旧Twitter）": null,
    "所属": "日本共産党武蔵野市議団"
  },
  {
    "氏名": "橋本　しげき",
    "登録名": "橋本　しげき",
    "よみ": "はしもと しげき",
    "X（旧Twitter）": "https://x.com/hashimoto_JCP",
    "所属": "日本共産党武蔵野市議団"
  },
  {
    "氏名": "三島　杉子",
    "登録名": "三島　杉子",
    "よみ": "みしま すぎこ",
    "X（旧Twitter）": "https://x.com/mishima_sugiko",
    "所属": "日本共産党武蔵野市議団"
  },
  {
    "氏名": "深田　貴美子",
    "登録名": "深田　貴美子",
    "よみ": "ふかた きみこ",
    "X（旧Twitter）": "https://x.com/fukakimi",
    "所属": "日本維新の会武蔵野市議団"
  },
  {
    "氏名": "東山　あきお",
    "登録名": "東山　あきお",
    "よみ": "ひがしやま あきお",
    "X（旧Twitter）": "https://x.com/akiohigashiyama",
    "所属": "日本維新の会武蔵野市議団"
  },
  {
    "氏名": "宮代　一利",
    "登録名": "宮代　一利",
    "よみ": "みやしろ かずとし",
    "X（旧Twitter）": null,
    "所属": "ワクワクはたらく"
  },
  {
    "氏名": "本多　夏帆",
    "登録名": "本多　夏帆",
    "よみ": "ほんだ なつほ",
    "X（旧Twitter）": "https://x.com/natsuhonda8",
    "所属": "ワクワクはたらく"
  },
  {
    "氏名": "さこう　もみ",
    "登録名": "さこう　もみ",
    "よみ": "さこう もみ",
    "X（旧Twitter）": "https://x.com/SAKOMOMI",
    "所属": "無所属むさしの"
  },
  {
    "氏名": "山本　ひとみ",
    "登録名": "山本　ひとみ",
    "よみ": "やまもと ひとみ",
    "X（旧Twitter）": "https://x.com/hitomi_yamamot",
    "所属": "無所属むさしの"
  },
  {
    "氏名": "小林　まさよし",
    "登録名": "小林　まさよし",
    "よみ": "こばやし まさよし",
    "X（旧Twitter）": "https://x.com/kobayashi__masa",
    "所属": "会派に属さない議員"
  },
  {
    "氏名": "下田　ひろき",
    "登録名": "下田　ひろき",
    "よみ": "しもだ ひろき",
    "X（旧Twitter）": null,
    "所属": "会派に属さない議員"
  }
]