[
  {
    "氏名": "あらたに　隆見",
    "登録名": "あらたに　隆見",
    "よみ": "あらたに　たかみ",
    "X（旧Twitter）": null,
    "所属": "公明党"
  },
  {
    "氏名": "いいじま　文彦",
    "登録名": "いいじま　文彦",
    "よみ": "いいじま　ふみひこ",
    "X（旧Twitter）": "https://x.com/IIJIMAfumihiko",
    "所属": "自民党"
  },
  {
    "氏名": "池田　けい子",
    "登録名": "池田　けい子",
    "よみ": "いけだ　けいこ",
    "X（旧Twitter）": "https://x.com/IwMOlTKFQQCfNbA",
    "所属": "公明党"
  },
  {
    "氏名": "石山　ひろあき",
    "登録名": "石山　ひろあき",
    "よみ": "いしやま　ひろあき",
    "X（旧Twitter）": null,
    "所属": "自民党"
  },
  {
    "氏名": "いぢち　恭子",
    "登録名": "いぢち　恭子",
    "よみ": "いぢち　きょうこ",
    "X（旧Twitter）": "https://x.com/kyoko_ijichi",
    "所属": "ネット・社民の会"
  },
  {
    "氏名": "岩崎　みなこ",
    "登録名": "岩崎　みなこ",
    "よみ": "いわさき　みなこ",
    "X（旧Twitter）": "https://x.com/iwasaki_ikiiki",
    "所属": "ネット・社民の会"
  },
  {
    "氏名": "上杉　ただし",
    "登録名": "上杉　ただし",
    "よみ": "うえすぎ　ただし",
    "X（旧Twitter）": null,
    "所属": "日本共産党"
  },
  {
    "氏名": "大くま　真一",
    "登録名": "大くま　真一",
    "よみ": "おおくま　しんいち",
    "X（旧Twitter）": "https://x.com/ookumasinniti",
    "所属": "日本共産党"
  },
  {
    "氏名": "おにづか　こずえ",
    "登録名": "おにづか　こずえ",
    "よみ": "おにづか　こずえ",
    "X（旧Twitter）": null,
    "所属": "あすたま・維新"
  },
  {
    "氏名": "折戸　小夜子",
    "登録名": "折戸　小夜子",
    "よみ": "おりと　さよこ",
    "X（旧Twitter）": null,
    "所属": "多摩の風"
  },
  {
    "氏名": "岸田　めぐみ",
    "登録名": "岸田　めぐみ",
    "よみ": "きしだ　めぐみ",
    "X（旧Twitter）": null,
    "所属": "ネット・社民の会"
  },
  {
    "氏名": "きりき　優",
    "登録名": "きりき　優",
    "よみ": "きりき　ゆたか",
    "X（旧Twitter）": "https://x.com/kiriki_yutaka",
    "所属": "自民党"
  },
  {
    "氏名": "小林　憲一",
    "登録名": "小林　憲一",
    "よみ": "こばやし　けんいち",
    "X（旧Twitter）": "https://x.com/kobakenjcp",
    "所属": "日本共産党"
  },
  {
    "氏名": "三階　道雄",
    "登録名": "三階　道雄",
    "よみ": "さんがい　みちお",
    "X（旧Twitter）": null,
    "所属": "公明党"
  },
  {
    "氏名": "しのづか　元",
    "登録名": "しのづか　元",
    "よみ": "しのづか　げん",
    "X（旧Twitter）": null,
    "所属": "多摩みらいの会"
  },
  {
    "氏名": "しらた　満",
    "登録名": "しらた　満",
    "よみ": "しらた　みつる",
    "X（旧Twitter）": null,
    "所属": "青空りっけん"
  },
  {
    "氏名": "藤條　たかゆき",
    "登録名": "藤條　たかゆき",
    "よみ": "とうじょう　たかゆき",
    "X（旧Twitter）": "https://x.com/taka_ishin",
    "所属": "日本維新の会"
  },
  {
    "氏名": "中島　律子",
    "登録名": "中島　律子",
    "よみ": "なかじま　りつこ",
    "X（旧Twitter）": null,
    "所属": "あすたま・維新"
  },
  {
    "氏名": "橋本　由美子",
    "登録名": "橋本　由美子",
    "よみ": "はしもと　ゆみこ",
    "X（旧Twitter）": null,
    "所属": "日本共産党"
  },
  {
    "氏名": "藤原　マサノリ",
    "登録名": "藤原　マサノリ",
    "よみ": "ふじわら　まさのり",
    "X（旧Twitter）": "https://x.com/fmasanatsu",
    "所属": "志政会"
  },
  {
    "氏名": "本間　としえ",
    "登録名": "本間　としえ",
    "よみ": "ほんま　としえ",
    "X（旧Twitter）": "https://x.com/hommatoshie",
    "所属": "公明党"
  },
  {
    "氏名": "松田　だいすけ",
    "登録名": "松田　だいすけ",
    "よみ": "まつだ　だいすけ",
    "X（旧Twitter）": "https://x.com/daisuke7matsuda",
    "所属": "自民党"
  },
  {
    "氏名": "渡辺　しんじ",
    "登録名": "渡辺　しんじ",
    "よみ": "わたなべ　しんじ",
    "X（旧Twitter）": null,
    "所属": "公明党"
  }
]