[
  {
    "氏名": "稲垣　裕二",
    "登録名": "稲垣　裕二",
    "よみ": "いながき　ゆうじ",
    "X（旧Twitter）": null,
    "所属": "自由民主党西東京市議団"
  },
  {
    "氏名": "大竹　あつ子",
    "登録名": "大竹　あつ子",
    "よみ": "おおたけ　あつこ",
    "X（旧Twitter）": null,
    "所属": "日本共産党西東京市議団"
  },
  {
    "氏名": "大林　光昭",
    "登録名": "大林　光昭",
    "よみ": "おおばやし　みつあき",
    "X（旧Twitter）": null,
    "所属": "西東京市議会公明党"
  },
  {
    "氏名": "かとう　涼子",
    "登録名": "かとう　涼子",
    "よみ": "かとう　りょうこ",
    "X（旧Twitter）": null,
    "所属": "生活者ネットワーク"
  },
  {
    "氏名": "後藤　ゆう子",
    "登録名": "後藤　ゆう子",
    "よみ": "ごとう　ゆうこ",
    "X（旧Twitter）": null,
    "所属": "生活者ネットワーク"
  },
  {
    "氏名": "小林　たつや",
    "登録名": "小林　たつや",
    "よみ": "こばやし　たつや",
    "X（旧Twitter）": null,
    "所属": "自由民主党西東京市議団"
  },
  {
    "氏名": "坂井　かずひこ",
    "登録名": "坂井　かずひこ",
    "よみ": "さかい　かずひこ",
    "X（旧Twitter）": null,
    "所属": "自由民主党西東京市議団"
  },
  {
    "氏名": "酒井　ごう一郎",
    "登録名": "酒井　ごう一郎",
    "よみ": "さかい　ごういちろう",
    "X（旧Twitter）": null,
    "所属": "自由民主党西東京市議団"
  },
  {
    "氏名": "佐藤　公男",
    "登録名": "佐藤　公男",
    "よみ": "さとう　きみお",
    "X（旧Twitter）": null,
    "所属": "西東京市議会公明党"
  },
  {
    "氏名": "佐藤　大介",
    "登録名": "佐藤　大介",
    "よみ": "さとう　だいすけ",
    "X（旧Twitter）": "https://x.com/Sato_satodai",
    "所属": "自由民主党西東京市議団"
  },
  {
    "氏名": "下田　純一",
    "登録名": "下田　純一",
    "よみ": "しもだ　じゅんいち",
    "X（旧Twitter）": null,
    "所属": "無所属"
  },
  {
    "氏名": "菅原　みほ",
    "登録名": "菅原　みほ",
    "よみ": "すがわら　みほ",
    "X（旧Twitter）": null,
    "所属": "立憲民主党"
  },
  {
    "氏名": "鈴木　ゆうま",
    "登録名": "鈴木　ゆうま",
    "よみ": "すずき　ゆうま",
    "X（旧Twitter）": null,
    "所属": "維新・国民民主"
  },
  {
    "氏名": "千間　いずみ",
    "登録名": "千間　いずみ",
    "よみ": "せんま　いずみ",
    "X（旧Twitter）": null,
    "所属": "立憲民主党"
  },
  {
    "氏名": "田代　伸之",
    "登録名": "田代　伸之",
    "よみ": "たしろ　のぶゆき",
    "X（旧Twitter）": null,
    "所属": "西東京市議会公明党"
  },
  {
    "氏名": "田村　ひろゆき",
    "登録名": "田村　ひろゆき",
    "よみ": "たむら　ひろゆき",
    "X（旧Twitter）": null,
    "所属": "無所属"
  },
  {
    "氏名": "とみなが　ゆうじ",
    "登録名": "とみなが　ゆうじ",
    "よみ": "とみなが　ゆうじ",
    "X（旧Twitter）": null,
    "所属": "自由民主党西東京市議団"
  },
  {
    "氏名": "長井　秀和",
    "登録名": "長井　秀和",
    "よみ": "ながい　ひでかず",
    "X（旧Twitter）": null,
    "所属": "無所属"
  },
  {
    "氏名": "中川　清志",
    "登録名": "中川　清志",
    "よみ": "なかがわ　きよし",
    "X（旧Twitter）": null,
    "所属": "自由民主党西東京市議団"
  },
  {
    "氏名": "中村　すぐる",
    "登録名": "中村　すぐる",
    "よみ": "なかむら　すぐる",
    "X（旧Twitter）": null,
    "所属": "日本共産党西東京市議団"
  },
  {
    "氏名": "納田　さおり",
    "登録名": "納田　さおり",
    "よみ": "のうだ　さおり",
    "X（旧Twitter）": null,
    "所属": "無所属"
  },
  {
    "氏名": "八矢　好美",
    "登録名": "八矢　好美",
    "よみ": "はちや　よしみ",
    "X（旧Twitter）": null,
    "所属": "西東京市議会公明党"
  },
  {
    "氏名": "藤田　美智子",
    "登録名": "藤田　美智子",
    "よみ": "ふじた　みちこ",
    "X（旧Twitter）": null,
    "所属": "西東京市議会公明党"
  },
  {
    "氏名": "保谷　なおみ",
    "登録名": "保谷　なおみ",
    "よみ": "ほうや　なおみ",
    "X（旧Twitter）": null,
    "所属": "自由民主党西東京市議団"
  },
  {
    "氏名": "森　しんいち",
    "登録名": "森　しんいち",
    "よみ": "もり　しんいち",
    "X（旧Twitter）": null,
    "所属": "立憲民主党"
  },
  {
    "氏名": "やまき　明美",
    "登録名": "やまき　明美",
    "よみ": "やまき　あけみ",
    "X（旧Twitter）": null,
    "所属": "日本共産党西東京市議団"
  },
  {
    "氏名": "山崎　英昭",
    "登録名": "山崎　英昭",
    "よみ": "やまざき　ひであき",
    "X（旧Twitter）": null,
    "所属": "維新・国民民主"
  },
  {
    "氏名": "山田　忠良",
    "登録名": "山田　忠良",
    "よみ": "やまだ　ただよし",
    "X（旧Twitter）": null,
    "所属": "自由民主党西東京市議団"
  }
]