[
  {
    "氏名": "わたなべ　三枝",
    "登録名": "わたなべ　三枝",
    "よみ": "わたなべ　みつえ",
    "X（旧Twitter）": null,
    "所属": "日本共産党日野市議団"
  },
  {
    "氏名": "岡田　じゅん子",
    "登録名": "岡田　じゅん子",
    "よみ": "おかだ　じゅんこ",
    "X（旧Twitter）": "https://x.com/jokada_hino",
    "所属": "日本共産党日野市議団"
  },
  {
    "氏名": "佐藤　琢磨",
    "登録名": "佐藤　琢磨",
    "よみ": "さとう　たくま",
    "X（旧Twitter）": null,
    "所属": "無会派"
  },
  {
    "氏名": "新井　ともはる",
    "登録名": "新井　ともはる",
    "よみ": "あらい　ともはる",
    "X（旧Twitter）": "https://x.com/tomoharu_arai",
    "所属": "無会派"
  },
  {
    "氏名": "伊東　秀章",
    "登録名": "伊東　秀章",
    "よみ": "いとう　ひであき",
    "X（旧Twitter）": "https://x.com/hideakiito_hino",
    "所属": "無会派"
  },
  {
    "氏名": "須崎　貴寛",
    "登録名": "須崎　貴寛",
    "よみ": "すざき　たかひろ",
    "X（旧Twitter）": null,
    "所属": "自由民主党日野市議団"
  },
  {
    "氏名": "伊藤　あゆみ",
    "登録名": "伊藤　あゆみ",
    "よみ": "いとう　あゆみ",
    "X（旧Twitter）": "https://x.com/AyumiIto55",
    "所属": "自由民主党日野市議団"
  },
  {
    "氏名": "ちかざわ　美樹",
    "登録名": "ちかざわ　美樹",
    "よみ": "ちかざわ　みき",
    "X（旧Twitter）": null,
    "所属": "日本共産党日野市議団"
  },
  {
    "氏名": "白井　なおこ",
    "登録名": "白井　なおこ",
    "よみ": "しらい　なおこ",
    "X（旧Twitter）": null,
    "所属": "無会派"
  },
  {
    "氏名": "森沢　美和子",
    "登録名": "森沢　美和子",
    "よみ": "もりさわ　みわこ",
    "X（旧Twitter）": "https://x.com/morisawa_miwako",
    "所属": "チームみらい"
  },
  {
    "氏名": "島谷　広則",
    "登録名": "島谷　広則",
    "よみ": "しまや　ひろのり",
    "X（旧Twitter）": null,
    "所属": "チームみらい"
  },
  {
    "氏名": "中嶋　良樹",
    "登録名": "中嶋　良樹",
    "よみ": "なかじま　よしき",
    "X（旧Twitter）": null,
    "所属": "チームみらい"
  },
  {
    "氏名": "鈴木　洋子",
    "登録名": "鈴木　洋子",
    "よみ": "すずき　ようこ",
    "X（旧Twitter）": null,
    "所属": "自由民主党日野市議団"
  },
  {
    "氏名": "中野　あきと",
    "登録名": "中野　あきと",
    "よみ": "なかの　あきと",
    "X（旧Twitter）": null,
    "所属": "日本共産党日野市議団"
  },
  {
    "氏名": "池田　としえ",
    "登録名": "池田　としえ",
    "よみ": "いけだ　としえ",
    "X（旧Twitter）": "https://x.com/m8BIOzfZ6VaZRDA",
    "所属": "無会派"
  },
  {
    "氏名": "奥野　りん子",
    "登録名": "奥野　りん子",
    "よみ": "おくの　りんこ",
    "X（旧Twitter）": null,
    "所属": "無会派"
  },
  {
    "氏名": "峯岸　弘行",
    "登録名": "峯岸　弘行",
    "よみ": "みねぎし　ひろゆき",
    "X（旧Twitter）": "https://x.com/kyokucho313",
    "所属": "公明党"
  },
  {
    "氏名": "窪田　知子",
    "登録名": "窪田　知子",
    "よみ": "くぼた　ともこ",
    "X（旧Twitter）": "https://x.com/kubotahino",
    "所属": "公明党"
  },
  {
    "氏名": "馬場　賢司",
    "登録名": "馬場　賢司",
    "よみ": "ばば　けんじ",
    "X（旧Twitter）": null,
    "所属": "公明党"
  },
  {
    "氏名": "田原　茂",
    "登録名": "田原　茂",
    "よみ": "たはら　しげる",
    "X（旧Twitter）": null,
    "所属": "公明党"
  },
  {
    "氏名": "谷　和彦",
    "登録名": "谷　和彦",
    "よみ": "たに　かずひこ",
    "X（旧Twitter）": null,
    "所属": "無会派"
  },
  {
    "氏名": "奥住　匡人",
    "登録名": "奥住　匡人",
    "よみ": "おくずみ　まさひと",
    "X（旧Twitter）": null,
    "所属": "自由民主党日野市議団"
  },
  {
    "氏名": "吉澤　あかね",
    "登録名": "吉澤　あかね",
    "よみ": "よしざわ　あかね",
    "X（旧Twitter）": null,
    "所属": "無会派"
  }
]