[
  {
    "氏名": "小林　市之",
    "登録名": "小林　市之",
    "よみ": "こばやし いちの",
    "X（旧Twitter）": null,
    "所属": "公明党"
  },
  {
    "氏名": "丸田　絵美",
    "登録名": "丸田　絵美",
    "よみ": "まるた えみ",
    "X（旧Twitter）": null,
    "所属": "チャレンジ調布21"
  },
  {
    "氏名": "田村　ゆう子",
    "登録名": "田村　ゆう子",
    "よみ": "たむら ゆうこ",
    "X（旧Twitter）": null,
    "所属": "日本共産党"
  },
  {
    "氏名": "雨宮　幸男",
    "登録名": "雨宮　幸男",
    "よみ": "あめみや ゆきお",
    "X（旧Twitter）": null,
    "所属": "日本共産党"
  },
  {
    "氏名": "井樋　匡利",
    "登録名": "井樋　匡利",
    "よみ": "いび まさとし",
    "X（旧Twitter）": null,
    "所属": "自民党新政会"
  },
  {
    "氏名": "渡辺　進二郎",
    "登録名": "渡辺　進二郎",
    "よみ": "わたなべ しんじろう",
    "X（旧Twitter）": null,
    "所属": "自民党新政会"
  },
  {
    "氏名": "伊藤　学",
    "登録名": "伊藤　学",
    "よみ": "いとう まなぶ",
    "X（旧Twitter）": null,
    "所属": "自民党新政会"
  },
  {
    "氏名": "川畑　英樹",
    "登録名": "川畑　英樹",
    "よみ": "かわばた ひでき",
    "X（旧Twitter）": null,
    "所属": "公明党"
  },
  {
    "氏名": "平野　充",
    "登録名": "平野　充",
    "よみ": "ひらの みつる",
    "X（旧Twitter）": null,
    "所属": "公明党"
  },
  {
    "氏名": "鮎川　有祐",
    "登録名": "鮎川　有祐",
    "よみ": "あゆかわ ゆうすけ",
    "X（旧Twitter）": null,
    "所属": "チャレンジ調布21"
  },
  {
    "氏名": "大野　祐司",
    "登録名": "大野　祐司",
    "よみ": "おおの ゆうじ",
    "X（旧Twitter）": null,
    "所属": "チャレンジ調布21"
  },
  {
    "氏名": "須山　妙子",
    "登録名": "須山　妙子",
    "よみ": "すやま たえこ",
    "X（旧Twitter）": null,
    "所属": "日本共産党"
  },
  {
    "氏名": "野沢　久美子",
    "登録名": "野沢　久美子",
    "よみ": "のざわ くみこ",
    "X（旧Twitter）": null,
    "所属": "れいわネット・にじいろの会"
  },
  {
    "氏名": "二宮　陽子",
    "登録名": "二宮　陽子",
    "よみ": "にのみや ようこ",
    "X（旧Twitter）": null,
    "所属": "れいわネット・にじいろの会"
  },
  {
    "氏名": "榊原　登志子",
    "登録名": "榊原　登志子",
    "よみ": "さかきばら としこ",
    "X（旧Twitter）": null,
    "所属": "調布ミライ政策会議"
  },
  {
    "氏名": "狩野　明彦",
    "登録名": "狩野　明彦",
    "よみ": "かのう あきひこ",
    "X（旧Twitter）": null,
    "所属": "調布ミライ政策会議"
  },
  {
    "氏名": "清水　仁恵",
    "登録名": "清水　仁恵",
    "よみ": "しみず ひとえ",
    "X（旧Twitter）": null,
    "所属": "調布ミライ政策会議"
  },
  {
    "氏名": "宮本　和実",
    "登録名": "宮本　和実",
    "よみ": "みやもと かずみ",
    "X（旧Twitter）": null,
    "所属": "公明党"
  },
  {
    "氏名": "西牟田　ひろし",
    "登録名": "西牟田　ひろし",
    "よみ": "にしむた ひろし",
    "X（旧Twitter）": null,
    "所属": "チャレンジ調布21"
  },
  {
    "氏名": "古川　陽菜",
    "登録名": "古川　陽菜",
    "よみ": "ふるかわ ひな",
    "X（旧Twitter）": null,
    "所属": "チャレンジ調布21"
  },
  {
    "氏名": "澤井　慧",
    "登録名": "澤井　慧",
    "よみ": "さわい けい",
    "X（旧Twitter）": null,
    "所属": "公明党"
  },
  {
    "氏名": "坂内　淳",
    "登録名": "坂内　淳",
    "よみ": "ばんない じゅん",
    "X（旧Twitter）": null,
    "所属": "調布ミライ政策会議"
  },
  {
    "氏名": "阿部　真二郎",
    "登録名": "阿部　真二郎",
    "よみ": "あべ しんじろう",
    "X（旧Twitter）": null,
    "所属": "自民党新政会"
  },
  {
    "氏名": "岸本　直子",
    "登録名": "岸本　直子",
    "よみ": "きしもと なおこ",
    "X（旧Twitter）": null,
    "所属": "日本共産党"
  },
  {
    "氏名": "内藤　美貴子",
    "登録名": "内藤　美貴子",
    "よみ": "ないとう みきこ",
    "X（旧Twitter）": null,
    "所属": "調布ミライ政策会議"
  },
  {
    "氏名": "木下　安子",
    "登録名": "木下　安子",
    "よみ": "きのした やすこ",
    "X（旧Twitter）": null,
    "所属": "チャレンジ調布21"
  },
  {
    "氏名": "小林　充夫",
    "登録名": "小林　充夫",
    "よみ": "こばやし みつお",
    "X（旧Twitter）": null,
    "所属": "自民党新政会"
  },
  {
    "氏名": "元木　勇",
    "登録名": "元木　勇",
    "よみ": "もとき いさむ",
    "X（旧Twitter）": null,
    "所属": "自民党新政会"
  }
]