[
  {
    "氏名": "小町　明夫",
    "登録名": "小町　明夫",
    "よみ": "こまち あきお",
    "X（旧Twitter）": null,
    "所属": "自由民主党"
  },
  {
    "氏名": "鈴木　たつお",
    "登録名": "鈴木　たつお",
    "よみ": "すずき たつお",
    "X（旧Twitter）": "https://x.com/tatsuosuzukitw",
    "所属": "諸派"
  },
  {
    "氏名": "朝木　直子",
    "登録名": "朝木　直子",
    "よみ": "あさき なおこ",
    "X（旧Twitter）": "https://x.com/asakinaoko",
    "所属": "草の根市民クラブ"
  },
  {
    "氏名": "子安　じゅん",
    "登録名": "子安　じゅん",
    "よみ": "こやす じゅん",
    "X（旧Twitter）": null,
    "所属": "草の根市民クラブ"
  },
  {
    "氏名": "木村　隆",
    "登録名": "木村　隆",
    "よみ": "きむら たかし",
    "X（旧Twitter）": null,
    "所属": "自由民主党"
  },
  {
    "氏名": "下沢　ゆきお",
    "登録名": "下沢　ゆきお",
    "よみ": "しもざわ ゆきお",
    "X（旧Twitter）": null,
    "所属": "自由民主党"
  },
  {
    "氏名": "かくた　かづほ",
    "登録名": "かくた　かづほ",
    "よみ": "かくた かづほ",
    "X（旧Twitter）": null,
    "所属": "諸派"
  },
  {
    "氏名": "佐藤　まさたか",
    "登録名": "佐藤　まさたか",
    "よみ": "さとう まさたか",
    "X（旧Twitter）": "https://x.com/sato_masataka",
    "所属": "諸派"
  },
  {
    "氏名": "白石　えつ子",
    "登録名": "白石　えつ子",
    "よみ": "しらいし えつこ",
    "X（旧Twitter）": null,
    "所属": "諸派"
  },
  {
    "氏名": "わたなべ　たかし",
    "登録名": "わたなべ　たかし",
    "よみ": "わたなべ たかし",
    "X（旧Twitter）": null,
    "所属": "諸派"
  },
  {
    "氏名": "渡辺　みのる",
    "登録名": "渡辺　みのる",
    "よみ": "わたなべ みのる",
    "X（旧Twitter）": "https://x.com/musashino_udon",
    "所属": "日本共産党"
  },
  {
    "氏名": "浅見　みどり",
    "登録名": "浅見　みどり",
    "よみ": "あさみ みどり",
    "X（旧Twitter）": null,
    "所属": "日本共産党"
  },
  {
    "氏名": "熊木　敏己",
    "登録名": "熊木　敏己",
    "よみ": "くまき としみ",
    "X（旧Twitter）": null,
    "所属": "自由民主党"
  },
  {
    "氏名": "小林　美緒",
    "登録名": "小林　美緒",
    "よみ": "こばやし みお",
    "X（旧Twitter）": null,
    "所属": "自由民主党"
  },
  {
    "氏名": "伊藤　真一",
    "登録名": "伊藤　真一",
    "よみ": "いとう しんいち",
    "X（旧Twitter）": null,
    "所属": "公明党"
  },
  {
    "氏名": "渡辺　英子",
    "登録名": "渡辺　英子",
    "よみ": "わたなべ えいこ",
    "X（旧Twitter）": null,
    "所属": "公明党"
  },
  {
    "氏名": "石橋　光明",
    "登録名": "石橋　光明",
    "よみ": "いしばし みつあき",
    "X（旧Twitter）": null,
    "所属": "公明党"
  },
  {
    "氏名": "村山　じゅん子",
    "登録名": "村山　じゅん子",
    "よみ": "むらやま じゅんこ",
    "X（旧Twitter）": null,
    "所属": "公明党"
  },
  {
    "氏名": "駒崎　高行",
    "登録名": "駒崎　高行",
    "よみ": "こまざき たかゆき",
    "X（旧Twitter）": null,
    "所属": "公明党"
  },
  {
    "氏名": "横尾　たかお",
    "登録名": "横尾　たかお",
    "よみ": "よこお たかお",
    "X（旧Twitter）": null,
    "所属": "公明党"
  },
  {
    "氏名": "かみまち　弓子",
    "登録名": "かみまち　弓子",
    "よみ": "かみまち ゆみこ",
    "X（旧Twitter）": "https://x.com/preciousyuumin",
    "所属": "立憲民主党"
  },
  {
    "氏名": "清水　健文",
    "登録名": "清水　健文",
    "よみ": "しみず たけふみ",
    "X（旧Twitter）": null,
    "所属": "立憲民主党"
  },
  {
    "氏名": "山田　たか子",
    "登録名": "山田　たか子",
    "よみ": "やまだ たかこ",
    "X（旧Twitter）": null,
    "所属": "日本共産党"
  },
  {
    "氏名": "さとう　直子",
    "登録名": "さとう　直子",
    "よみ": "さとう なおこ",
    "X（旧Twitter）": null,
    "所属": "日本共産党"
  }
]