[
  {
    "氏名": "小林　ひろえ",
    "登録名": "小林　ひろえ",
    "よみ": "こばやし ひろえ",
    "X（旧Twitter）": "https://x.com/TUMANIKKI",
    "所属": "立憲民主党"
  },
  {
    "氏名": "岸田　こうすけ",
    "登録名": "岸田　こうすけ",
    "よみ": "きしだ こうすけ",
    "X（旧Twitter）": null,
    "所属": "自由民主党"
  },
  {
    "氏名": "九鬼　ともみ",
    "登録名": "九鬼　ともみ",
    "よみ": "くき ともみ",
    "X（旧Twitter）": null,
    "所属": "立憲民主党"
  },
  {
    "氏名": "鈴木　レオ",
    "登録名": "鈴木　レオ",
    "よみ": "すずき れお",
    "X（旧Twitter）": "https://x.com/leosuzuki",
    "所属": "自由民主党"
  },
  {
    "氏名": "わたばやし　ゆか",
    "登録名": "わたばやし　ゆか",
    "よみ": "わたばやし ゆか",
    "X（旧Twitter）": null,
    "所属": "日本共産党"
  },
  {
    "氏名": "みねべ　弥生",
    "登録名": "みねべ　弥生",
    "よみ": "みねべ やよい",
    "X（旧Twitter）": null,
    "所属": "公明党"
  },
  {
    "氏名": "森　ひでき",
    "登録名": "森　ひでき",
    "よみ": "もり ひでき",
    "X（旧Twitter）": null,
    "所属": "自由民主党"
  },
  {
    "氏名": "すぎやま　陽一",
    "登録名": "すぎやま　陽一",
    "よみ": "すぎやま よういち",
    "X（旧Twitter）": null,
    "所属": "公明党"
  },
  {
    "氏名": "うちだ　由香利",
    "登録名": "うちだ　由香利",
    "よみ": "うちだ ゆかり",
    "X（旧Twitter）": null,
    "所属": "自由民主党"
  },
  {
    "氏名": "渡口　よしたか",
    "登録名": "渡口　よしたか",
    "よみ": "とぐち よしたか",
    "X（旧Twitter）": null,
    "所属": "公明党"
  },
  {
    "氏名": "荻田　よね蔵",
    "登録名": "荻田　よね蔵",
    "よみ": "おぎた よねぞう",
    "X（旧Twitter）": null,
    "所属": "公明党"
  },
  {
    "氏名": "及川　けんいち",
    "登録名": "及川　けんいち",
    "よみ": "おいかわ けんいち",
    "X（旧Twitter）": null,
    "所属": "自由民主党"
  },
  {
    "氏名": "鈴木　ゆうじ",
    "登録名": "鈴木　ゆうじ",
    "よみ": "すずき ゆうじ",
    "X（旧Twitter）": null,
    "所属": "日本共産党"
  },
  {
    "氏名": "おおたけ　利明",
    "登録名": "おおたけ　利明",
    "よみ": "おおたけ としあき",
    "X（旧Twitter）": null,
    "所属": "自由民主党"
  },
  {
    "氏名": "山越　たくみ",
    "登録名": "山越　たくみ",
    "よみ": "やまこし たくみ",
    "X（旧Twitter）": null,
    "所属": "立憲民主党"
  },
  {
    "氏名": "長谷川　じゅんこ",
    "登録名": "長谷川　じゅんこ",
    "よみ": "はせがわ じゅんこ",
    "X（旧Twitter）": null,
    "所属": "自由民主党"
  },
  {
    "氏名": "馬場　たかひろ",
    "登録名": "馬場　たかひろ",
    "よみ": "ばば たかひろ",
    "X（旧Twitter）": "https://x.com/babatakahiro802",
    "所属": "自由民主党"
  },
  {
    "氏名": "金子　あきこ",
    "登録名": "金子　あきこ",
    "よみ": "かねこ あきこ",
    "X（旧Twitter）": null,
    "所属": "八王子・生活者ネットワーク"
  },
  {
    "氏名": "中島　まさおみ",
    "登録名": "中島　まさおみ",
    "よみ": "なかじま まさおみ",
    "X（旧Twitter）": null,
    "所属": "公明党"
  },
  {
    "氏名": "西山　たまき",
    "登録名": "西山　たまき",
    "よみ": "にしやま たまき",
    "X（旧Twitter）": null,
    "所属": "公明党"
  },
  {
    "氏名": "西本　かずこ",
    "登録名": "西本　かずこ",
    "よみ": "にしもと かずこ",
    "X（旧Twitter）": null,
    "所属": "日本共産党"
  },
  {
    "氏名": "むらまつ　とおる",
    "登録名": "むらまつ　とおる",
    "よみ": "むらまつ とおる",
    "X（旧Twitter）": null,
    "所属": "公明党"
  },
  {
    "氏名": "いちかわ　克宏",
    "登録名": "いちかわ　克宏",
    "よみ": "いちかわ かつひろ",
    "X（旧Twitter）": null,
    "所属": "自由民主党"
  },
  {
    "氏名": "浜中　けんじ",
    "登録名": "浜中　けんじ",
    "よみ": "はまなか けんじ",
    "X（旧Twitter）": null,
    "所属": "公明党"
  },
  {
    "氏名": "梶原　こうき",
    "登録名": "梶原　こうき",
    "よみ": "かじわら こうき",
    "X（旧Twitter）": null,
    "所属": "自由民主党"
  },
  {
    "氏名": "安藤　しゅうぞう",
    "登録名": "安藤　しゅうぞう",
    "よみ": "あんどう しゅうぞう",
    "X（旧Twitter）": null,
    "所属": "立憲民主党"
  },
  {
    "氏名": "吉本　よしはる",
    "登録名": "吉本　よしはる",
    "よみ": "よしもと よしはる",
    "X（旧Twitter）": null,
    "所属": "公明党"
  },
  {
    "氏名": "前田　かよこ",
    "登録名": "前田　かよこ",
    "よみ": "まえだ かよこ",
    "X（旧Twitter）": null,
    "所属": "自由民主党"
  },
  {
    "氏名": "高橋　つとむ",
    "登録名": "高橋　つとむ",
    "よみ": "たかはし つとむ",
    "X（旧Twitter）": null,
    "所属": "無所属"
  },
  {
    "氏名": "もちづき　ゆか",
    "登録名": "もちづき　ゆか",
    "よみ": "もちづき ゆか",
    "X（旧Twitter）": null,
    "所属": "日本共産党"
  },
  {
    "氏名": "玉　正彩加",
    "登録名": "玉　正彩加",
    "よみ": "たま まさやか",
    "X（旧Twitter）": null,
    "所属": "八王子・生活者ネットワーク"
  },
  {
    "氏名": "いわた　祐樹",
    "登録名": "いわた　祐樹",
    "よみ": "いわた ゆうき",
    "X（旧Twitter）": null,
    "所属": "自由民主党"
  },
  {
    "氏名": "いしい　宏和",
    "登録名": "いしい　宏和",
    "よみ": "いしい ひろかず",
    "X（旧Twitter）": null,
    "所属": "立憲民主党"
  },
  {
    "氏名": "福安　とおる",
    "登録名": "福安　とおる",
    "よみ": "ふくやす とおる",
    "X（旧Twitter）": "https://x.com/FukuyasuToru",
    "所属": "自由民主党"
  },
  {
    "氏名": "高木　あつし",
    "登録名": "高木　あつし",
    "よみ": "たかぎ あつし",
    "X（旧Twitter）": null,
    "所属": "都民ファーストの会"
  },
  {
    "氏名": "いしかわ　ゆうこ",
    "登録名": "いしかわ　ゆうこ",
    "よみ": "いしかわ ゆうこ",
    "X（旧Twitter）": null,
    "所属": "日本共産党"
  },
  {
    "氏名": "ふなき　しょうへい",
    "登録名": "ふなき　しょうへい",
    "よみ": "ふなき しょうへい",
    "X（旧Twitter）": null,
    "所属": "無所属"
  },
  {
    "氏名": "山本　たかふみ",
    "登録名": "山本　たかふみ",
    "よみ": "やまもと たかふみ",
    "X（旧Twitter）": null,
    "所属": "参政党"
  },
  {
    "氏名": "ほしの　なおみ",
    "登録名": "ほしの　なおみ",
    "よみ": "ほしの なおみ",
    "X（旧Twitter）": "https://x.com/starnaomi",
    "所属": "無所属"
  }
]