[
  {
    "氏名": "太田　浩典",
    "登録名": "太田　浩典",
    "よみ": "おおた　ひろのり",
    "X（旧Twitter）": null,
    "所属": "小金井市政会"
  },
  {
    "氏名": "中井　れい子",
    "登録名": "中井　れい子",
    "よみ": "なかい　れいこ",
    "X（旧Twitter）": null,
    "所属": "小金井市政会"
  },
  {
    "氏名": "天野　かな",
    "登録名": "天野　かな",
    "よみ": "あまの　かな",
    "X（旧Twitter）": "https://x.com/amanokana_",
    "所属": "人新会"
  },
  {
    "氏名": "清水　学",
    "登録名": "清水　学",
    "よみ": "しみず　がく",
    "X（旧Twitter）": "https://x.com/gaku_koganei",
    "所属": "まちづくり"
  },
  {
    "氏名": "水谷　貴子",
    "登録名": "水谷　貴子",
    "よみ": "みずたに　たかこ",
    "X（旧Twitter）": null,
    "所属": "市民自治"
  },
  {
    "氏名": "長取　太郎",
    "登録名": "長取　太郎",
    "よみ": "ながとり　たろう",
    "X（旧Twitter）": null,
    "所属": "市民自治"
  },
  {
    "氏名": "安田　桂子",
    "登録名": "安田　桂子",
    "よみ": "やすだ　けいこ",
    "X（旧Twitter）": null,
    "所属": "市民ネットワーク"
  },
  {
    "氏名": "坂井　悦子",
    "登録名": "坂井　悦子",
    "よみ": "さかい　えつこ",
    "X（旧Twitter）": "https://twitter.com/sakaietsuko",
    "所属": "無・なでしこ"
  },
  {
    "氏名": "小林　正樹",
    "登録名": "小林　正樹",
    "よみ": "こばやし　まさき",
    "X（旧Twitter）": null,
    "所属": "小金井市政会"
  },
  {
    "氏名": "河野　麻美",
    "登録名": "河野　麻美",
    "よみ": "かわの　あさみ",
    "X（旧Twitter）": null,
    "所属": "公明党"
  },
  {
    "氏名": "沖浦　篤",
    "登録名": "沖浦　篤",
    "よみ": "おきうら　あつし",
    "X（旧Twitter）": null,
    "所属": "人新会"
  },
  {
    "氏名": "木蘭　典子",
    "登録名": "木蘭　典子",
    "よみ": "きらん　のりこ",
    "X（旧Twitter）": null,
    "所属": "人新会"
  },
  {
    "氏名": "村上　洋介",
    "登録名": "村上　洋介",
    "よみ": "むらかみ　ようすけ",
    "X（旧Twitter）": null,
    "所属": "あいそ"
  },
  {
    "氏名": "藤川　健二",
    "登録名": "藤川　健二",
    "よみ": "ふじかわ　けんじ",
    "X（旧Twitter）": null,
    "所属": "市政"
  },
  {
    "氏名": "田渕　久崇",
    "登録名": "田渕　久崇",
    "よみ": "たぶち　ひさたか",
    "X（旧Twitter）": null,
    "所属": "日本共産党"
  },
  {
    "氏名": "水上　浩",
    "登録名": "水上　浩",
    "よみ": "みずかみ　ひろし",
    "X（旧Twitter）": "https://x.com/mizuhiro8",
    "所属": "日本共産党"
  },
  {
    "氏名": "福原　康貴",
    "登録名": "福原　康貴",
    "よみ": "ふくはら　やすたか",
    "X（旧Twitter）": null,
    "所属": "公明党"
  },
  {
    "氏名": "遠藤　百合子",
    "登録名": "遠藤　百合子",
    "よみ": "えんどう　ゆりこ",
    "X（旧Twitter）": null,
    "所属": "公明党"
  },
  {
    "氏名": "岸田　正義",
    "登録名": "岸田　正義",
    "よみ": "きしだ　まさよし",
    "X（旧Twitter）": null,
    "所属": "人新会"
  },
  {
    "氏名": "鈴木　茂夫",
    "登録名": "鈴木　茂夫",
    "よみ": "すずき　しげお",
    "X（旧Twitter）": null,
    "所属": "人新会"
  },
  {
    "氏名": "斉藤　康夫",
    "登録名": "斉藤　康夫",
    "よみ": "さいとう　やすお",
    "X（旧Twitter）": "https://x.com/saitouyasuo2011",
    "所属": "公明"
  },
  {
    "氏名": "渡辺　大三",
    "登録名": "渡辺　大三",
    "よみ": "わたなべ　だいぞう",
    "X（旧Twitter）": "https://x.com/watanabedaizou",
    "所属": "子どもの未来"
  },
  {
    "氏名": "片山　薫",
    "登録名": "片山　薫",
    "よみ": "かたやま　かおる",
    "X（旧Twitter）": "https://x.com/katayamakaoru",
    "所属": "子どもの未来"
  },
  {
    "氏名": "森戸　洋子",
    "登録名": "森戸　洋子",
    "よみ": "もりと　ようこ",
    "X（旧Twitter）": "https://x.com/jcpyoko",
    "所属": "日本共産党"
  }
]