[
  {
    "氏名": "上村　和子",
    "登録名": "上村　和子",
    "よみ": "うえむら　かずこ",
    "X（旧Twitter）": null,
    "所属": "こぶしの木"
  },
  {
    "氏名": "小川　宏美",
    "登録名": "小川　宏美",
    "よみ": "おがわ　ひろみ",
    "X（旧Twitter）": "https://x.com/0gawa1183",
    "所属": "耕す未来＠くにたち"
  },
  {
    "氏名": "望月　健一",
    "登録名": "望月　健一",
    "よみ": "もちづき　けんいち",
    "X（旧Twitter）": "https://x.com/mochiken46",
    "所属": "みらいのくにたち"
  },
  {
    "氏名": "中川　貴大",
    "登録名": "中川　貴大",
    "よみ": "なかがわ　たかひろ",
    "X（旧Twitter）": "https://x.com/info_nakagawa",
    "所属": "日本維新の会"
  },
  {
    "氏名": "石井　めぐみ",
    "登録名": "石井　めぐみ",
    "よみ": "いしい　めぐみ",
    "X（旧Twitter）": null,
    "所属": "新しい議会"
  },
  {
    "氏名": "藤江　竜三",
    "登録名": "藤江　竜三",
    "よみ": "ふじえ　りゅうぞう",
    "X（旧Twitter）": "https://x.com/fujie_ryuzo",
    "所属": "新しい議会"
  },
  {
    "氏名": "大谷　俊樹",
    "登録名": "大谷　俊樹",
    "よみ": "おおたに　としき",
    "X（旧Twitter）": null,
    "所属": "自由民主党"
  },
  {
    "氏名": "矢部　新",
    "登録名": "矢部　新",
    "よみ": "やべ　あらた",
    "X（旧Twitter）": "https://x.com/yabe_arata",
    "所属": "日本共産党"
  },
  {
    "氏名": "古濱　薫",
    "登録名": "古濱　薫",
    "よみ": "こはま　かおる",
    "X（旧Twitter）": "https://x.com/kohamakaoru",
    "所属": "社民・ネット・風"
  },
  {
    "氏名": "中谷　絢子",
    "登録名": "中谷　絢子",
    "よみ": "なかたに　あやこ",
    "X（旧Twitter）": null,
    "所属": "社民・ネット・風"
  },
  {
    "氏名": "稗田　美菜子",
    "登録名": "稗田　美菜子",
    "よみ": "ひえだ　みなこ",
    "X（旧Twitter）": null,
    "所属": "立憲民主党"
  },
  {
    "氏名": "山口　智之",
    "登録名": "山口　智之",
    "よみ": "やまぐち　ともゆき",
    "X（旧Twitter）": "https://x.com/yamaguchi_tom",
    "所属": "公明党"
  },
  {
    "氏名": "遠藤　直弘",
    "登録名": "遠藤　直弘",
    "よみ": "えんどう　なおひろ",
    "X（旧Twitter）": null,
    "所属": "自由民主党"
  },
  {
    "氏名": "高柳　貴美代",
    "登録名": "高柳　貴美代",
    "よみ": "たかやなぎ　きみよ",
    "X（旧Twitter）": null,
    "所属": "自由民主党"
  },
  {
    "氏名": "住友　珠美",
    "登録名": "住友　珠美",
    "よみ": "すみとも　たまみ",
    "X（旧Twitter）": "https://x.com/5963tama",
    "所属": "日本共産党"
  },
  {
    "氏名": "関口　博",
    "登録名": "関口　博",
    "よみ": "せきぐち　ひろし",
    "X（旧Twitter）": null,
    "所属": "社民・ネット・風"
  },
  {
    "氏名": "藤田　貴裕",
    "登録名": "藤田　貴裕",
    "よみ": "ふじた　たかひろ",
    "X（旧Twitter）": null,
    "所属": "社民・ネット・風"
  },
  {
    "氏名": "香西　貴弘",
    "登録名": "香西　貴弘",
    "よみ": "こうざい　たかひろ",
    "X（旧Twitter）": "https://x.com/kouzai_takahiro",
    "所属": "公明党"
  },
  {
    "氏名": "青木　淳子",
    "登録名": "青木　淳子",
    "よみ": "あおき　じゅんこ",
    "X（旧Twitter）": "https://x.com/Onc8ok1rCgdwEZw",
    "所属": "公明党"
  },
  {
    "氏名": "石井　伸之",
    "登録名": "石井　伸之",
    "よみ": "いしい　のぶゆき",
    "X（旧Twitter）": "https://x.com/ishiinobuyuki",
    "所属": "自由民主党"
  },
  {
    "氏名": "青木　健",
    "登録名": "青木　健",
    "よみ": "あおき　けん",
    "X（旧Twitter）": null,
    "所属": "自由民主党"
  }
]