[
  {
    "氏名": "佐藤　弘治",
    "登録名": "佐藤　弘治",
    "よみ": "さとう　こうじ",
    "X（旧Twitter）": null,
    "所属": "正和会"
  },
  {
    "氏名": "仲間　正司",
    "登録名": "仲間　正司",
    "よみ": "なかま　まさし",
    "X（旧Twitter）": null,
    "所属": "正和会"
  },
  {
    "氏名": "森田　哲哉",
    "登録名": "森田　哲哉",
    "よみ": "もりた　てつや",
    "X（旧Twitter）": null,
    "所属": "正和会"
  },
  {
    "氏名": "山崎　貴裕",
    "登録名": "山崎　貴裕",
    "よみ": "やまざき　たかひろ",
    "X（旧Twitter）": null,
    "所属": "正和会"
  },
  {
    "氏名": "小林　貢",
    "登録名": "小林　貢",
    "よみ": "こばやし　みつぐ",
    "X（旧Twitter）": null,
    "所属": "正和会"
  },
  {
    "氏名": "川﨑　善友",
    "登録名": "川﨑　善友",
    "よみ": "かわさき　よしとも",
    "X（旧Twitter）": null,
    "所属": "公明党"
  },
  {
    "氏名": "西尾　壽々斗",
    "登録名": "西尾　壽々斗",
    "よみ": "にしお　すずと",
    "X（旧Twitter）": null,
    "所属": "日本維新の会"
  },
  {
    "氏名": "伊藤　広美",
    "登録名": "伊藤　広美",
    "よみ": "いとう　ひろみ",
    "X（旧Twitter）": null,
    "所属": "日本共産党"
  },
  {
    "氏名": "市毛　雅大",
    "登録名": "市毛　雅大",
    "よみ": "いちげ　まさひろ",
    "X（旧Twitter）": null,
    "所属": "日本共産党"
  },
  {
    "氏名": "市川　佳樹",
    "登録名": "市川　佳樹",
    "よみ": "いちかわ　よしき",
    "X（旧Twitter）": null,
    "所属": "立憲民主党"
  },
  {
    "氏名": "小澤　芳輝",
    "登録名": "小澤　芳輝",
    "よみ": "おざわ　よしき",
    "X（旧Twitter）": null,
    "所属": "正和会"
  },
  {
    "氏名": "武藤　政義",
    "登録名": "武藤　政義",
    "よみ": "むとう　まさよし",
    "X（旧Twitter）": null,
    "所属": "正和会"
  },
  {
    "氏名": "清水　義朋",
    "登録名": "清水　義朋",
    "よみ": "しみず　よしとも",
    "X（旧Twitter）": null,
    "所属": "正和会"
  },
  {
    "氏名": "青木　健",
    "登録名": "青木　健",
    "よみ": "あおき　けん",
    "X（旧Twitter）": null,
    "所属": "公明党"
  },
  {
    "氏名": "堀　雄一朗",
    "登録名": "堀　雄一朗",
    "よみ": "ほり　ゆういちろう",
    "X（旧Twitter）": null,
    "所属": "公明党"
  },
  {
    "氏名": "原田　剛",
    "登録名": "原田　剛",
    "よみ": "はらだ　つよし",
    "X（旧Twitter）": null,
    "所属": "公明党"
  },
  {
    "氏名": "三原　智子",
    "登録名": "三原　智子",
    "よみ": "みはら　ともこ",
    "X（旧Twitter）": null,
    "所属": "生活者ネットワーク"
  },
  {
    "氏名": "幡垣　正生",
    "登録名": "幡垣　正生",
    "よみ": "はたがき　まさお",
    "X（旧Twitter）": null,
    "所属": "スポーツ・文化を通じて人づくりと街づくりの会"
  }
]