[
  {
    "氏名": "林田　敦子",
    "登録名": "林田　敦子",
    "よみ": "はやしだ　あつこ",
    "X（旧Twitter）": null,
    "所属": "令和かがやき"
  },
  {
    "氏名": "櫻沢　裕人",
    "登録名": "櫻沢　裕人",
    "よみ": "さくらざわ　ひろと",
    "X（旧Twitter）": null,
    "所属": "新政会"
  },
  {
    "氏名": "池澤　敦",
    "登録名": "池澤　敦",
    "よみ": "いけざわ　あつし",
    "X（旧Twitter）": null,
    "所属": "新政会"
  },
  {
    "氏名": "野崎　和也",
    "登録名": "野崎　和也",
    "よみ": "のざき　かずや",
    "X（旧Twitter）": null,
    "所属": "新政会"
  },
  {
    "氏名": "金子　ひとみ",
    "登録名": "金子　ひとみ",
    "よみ": "かねこ　ひとみ",
    "X（旧Twitter）": null,
    "所属": "公明党"
  },
  {
    "氏名": "菅　勇真",
    "登録名": "菅　勇真",
    "よみ": "かん　ゆうしん",
    "X（旧Twitter）": null,
    "所属": "双葉会"
  },
  {
    "氏名": "秋山　義徳",
    "登録名": "秋山　義徳",
    "よみ": "あきやま　よしのり",
    "X（旧Twitter）": null,
    "所属": "新政会"
  },
  {
    "氏名": "高田　和登",
    "登録名": "高田　和登",
    "よみ": "たかだ　かずと",
    "X（旧Twitter）": null,
    "所属": "つながる力"
  },
  {
    "氏名": "浜中　順",
    "登録名": "浜中　順",
    "よみ": "はまなか　じゅん",
    "X（旧Twitter）": null,
    "所属": "日本共産党"
  },
  {
    "氏名": "冨松　崇",
    "登録名": "冨松　崇",
    "よみ": "とみまつ　たかし",
    "X（旧Twitter）": null,
    "所属": "新政会"
  },
  {
    "氏名": "中嶋　勝",
    "登録名": "中嶋　勝",
    "よみ": "なかじま　まさる",
    "X（旧Twitter）": null,
    "所属": "公明党"
  },
  {
    "氏名": "富永　訓正",
    "登録名": "富永　訓正",
    "よみ": "とみなが　のりまさ",
    "X（旧Twitter）": null,
    "所属": "公明党"
  },
  {
    "氏名": "鈴木　拓也",
    "登録名": "鈴木　拓也",
    "よみ": "すずき　たくや",
    "X（旧Twitter）": null,
    "所属": "日本共産党"
  },
  {
    "氏名": "山崎　陽一",
    "登録名": "山崎　陽一",
    "よみ": "やまざき　よういち",
    "X（旧Twitter）": null,
    "所属": "世論"
  },
  {
    "氏名": "馳平　耕三",
    "登録名": "馳平　耕三",
    "よみ": "はせひら　こうぞう",
    "X（旧Twitter）": null,
    "所属": "令和かがやき"
  },
  {
    "氏名": "石居　尚郎",
    "登録名": "石居　尚郎",
    "よみ": "いしい　ひさお",
    "X（旧Twitter）": null,
    "所属": "公明党"
  },
  {
    "氏名": "濱中　俊男",
    "登録名": "濱中　俊男",
    "よみ": "はまなか　としお",
    "X（旧Twitter）": null,
    "所属": "羽村市議会都民ファーストの会"
  },
  {
    "氏名": "門間　淑子",
    "登録名": "門間　淑子",
    "よみ": "もんま　ひでこ",
    "X（旧Twitter）": null,
    "所属": "市民ネットワーク"
  }
]