[
  {
    "氏名": "小林　こうじ",
    "登録名": "小林　こうじ",
    "よみ": "こばやし こうじ",
    "X（旧Twitter）": "https://x.com/koji_koba",
    "所属": "自由民主党昭島市議団"
  },
  {
    "氏名": "美座　たかあき",
    "登録名": "美座　たかあき",
    "よみ": "みざ たかあき",
    "X（旧Twitter）": null,
    "所属": "自由民主党昭島市議団"
  },
  {
    "氏名": "安保　満",
    "登録名": "安保　満",
    "よみ": "あんぽ みつる",
    "X（旧Twitter）": null,
    "所属": "自由民主党昭島市議団"
  },
  {
    "氏名": "髙橋　誠",
    "登録名": "髙橋　誠",
    "よみ": "たかはし まこと",
    "X（旧Twitter）": null,
    "所属": "自由民主党昭島市議団"
  },
  {
    "氏名": "三田　俊司",
    "登録名": "三田　俊司",
    "よみ": "みた しゅんじ",
    "X（旧Twitter）": null,
    "所属": "自由民主党昭島市議団"
  },
  {
    "氏名": "木﨑　親一",
    "登録名": "木﨑　親一",
    "よみ": "きざき しんいち",
    "X（旧Twitter）": null,
    "所属": "自由民主党昭島市議団"
  },
  {
    "氏名": "吉野　智之",
    "登録名": "吉野　智之",
    "よみ": "よしの ともゆき",
    "X（旧Twitter）": null,
    "所属": "公明党昭島市議団"
  },
  {
    "氏名": "松原　亜希子",
    "登録名": "松原　亜希子",
    "よみ": "まつばら あきこ",
    "X（旧Twitter）": null,
    "所属": "公明党昭島市議団"
  },
  {
    "氏名": "渡辺　純也",
    "登録名": "渡辺　純也",
    "よみ": "わたなべ じゅんや",
    "X（旧Twitter）": null,
    "所属": "公明党昭島市議団"
  },
  {
    "氏名": "赤沼　泰雄",
    "登録名": "赤沼　泰雄",
    "よみ": "あかぬま やすお",
    "X（旧Twitter）": null,
    "所属": "公明党昭島市議団"
  },
  {
    "氏名": "大島　ひろし",
    "登録名": "大島　ひろし",
    "よみ": "おおしま ひろし",
    "X（旧Twitter）": null,
    "所属": "公明党昭島市議団"
  },
  {
    "氏名": "佐藤　文子",
    "登録名": "佐藤　文子",
    "よみ": "さとう ふみこ",
    "X（旧Twitter）": null,
    "所属": "日本共産党昭島市議団"
  },
  {
    "氏名": "大野　ふびと",
    "登録名": "大野　ふびと",
    "よみ": "おおの ふびと",
    "X（旧Twitter）": null,
    "所属": "日本共産党昭島市議団"
  },
  {
    "氏名": "奥村　博",
    "登録名": "奥村　博",
    "よみ": "おくむら ひろし",
    "X（旧Twitter）": null,
    "所属": "日本共産党昭島市議団"
  },
  {
    "氏名": "ゆざ　まさ子",
    "登録名": "ゆざ　まさ子",
    "よみ": "ゆざ まさこ",
    "X（旧Twitter）": null,
    "所属": "都民ファーストの会・立憲民主党昭島市議団"
  },
  {
    "氏名": "ひえの　たかゆき",
    "登録名": "ひえの　たかゆき",
    "よみ": "ひえの たかゆき",
    "X（旧Twitter）": null,
    "所属": "都民ファーストの会・立憲民主党昭島市議団"
  },
  {
    "氏名": "八田　一彦",
    "登録名": "八田　一彦",
    "よみ": "はった かずひこ",
    "X（旧Twitter）": null,
    "所属": "都民ファーストの会・立憲民主党昭島市議団"
  },
  {
    "氏名": "青山　秀雄",
    "登録名": "青山　秀雄",
    "よみ": "あおやま ひでお",
    "X（旧Twitter）": null,
    "所属": "みらいネットワーク"
  },
  {
    "氏名": "林　まい子",
    "登録名": "林　まい子",
    "よみ": "はやし まいこ",
    "X（旧Twitter）": null,
    "所属": "みらいネットワーク"
  },
  {
    "氏名": "永井　みつる",
    "登録名": "永井　みつる",
    "よみ": "ながい みつる",
    "X（旧Twitter）": null,
    "所属": "無会派"
  },
  {
    "氏名": "なかお　フミヒト",
    "登録名": "なかお　フミヒト",
    "よみ": "なかお ふみひと",
    "X（旧Twitter）": null,
    "所属": "無会派"
  },
  {
    "氏名": "南雲　隆志",
    "登録名": "南雲　隆志",
    "よみ": "なぐも たかし",
    "X（旧Twitter）": null,
    "所属": "無会派"
  }
]