[
  {
    "氏名": "二宮　由子",
    "登録名": "二宮　由子",
    "よみ": "にのみや よしこ",
    "X（旧Twitter）": null,
    "所属": "立憲国民クラブ"
  },
  {
    "氏名": "大后　治雄",
    "登録名": "大后　治雄",
    "よみ": "だいご はるお",
    "X（旧Twitter）": "https://x.com/daigoharuo",
    "所属": "立憲国民クラブ"
  },
  {
    "氏名": "石田　昭太朗",
    "登録名": "石田　昭太朗",
    "よみ": "いしだ しょうたろう",
    "X（旧Twitter）": null,
    "所属": "立憲国民クラブ"
  },
  {
    "氏名": "関　綾子",
    "登録名": "関　綾子",
    "よみ": "せき あやこ",
    "X（旧Twitter）": null,
    "所属": "無所属"
  },
  {
    "氏名": "尾崎　利一",
    "登録名": "尾崎　利一",
    "よみ": "おざき りいち",
    "X（旧Twitter）": null,
    "所属": "共につくる東大和"
  },
  {
    "氏名": "上林　真佐恵",
    "登録名": "上林　真佐恵",
    "よみ": "かみばやし まさえ",
    "X（旧Twitter）": "https://x.com/masaekami",
    "所属": "共につくる東大和"
  },
  {
    "氏名": "中村　庄一郎",
    "登録名": "中村　庄一郎",
    "よみ": "なかむら しょういちろう",
    "X（旧Twitter）": null,
    "所属": "自由民主党新政会"
  },
  {
    "氏名": "木下　富雄",
    "登録名": "木下　富雄",
    "よみ": "きのした とみお",
    "X（旧Twitter）": null,
    "所属": "自由民主党新政会"
  },
  {
    "氏名": "森田　博之",
    "登録名": "森田　博之",
    "よみ": "もりた ひろゆき",
    "X（旧Twitter）": null,
    "所属": "自由民主党新政会"
  },
  {
    "氏名": "押本　修",
    "登録名": "押本　修",
    "よみ": "おしもと おさむ",
    "X（旧Twitter）": null,
    "所属": "自由民主党"
  },
  {
    "氏名": "蜂須賀　千雅",
    "登録名": "蜂須賀　千雅",
    "よみ": "はちすか かずまさ",
    "X（旧Twitter）": null,
    "所属": "自由民主党"
  },
  {
    "氏名": "髙峰　章",
    "登録名": "髙峰　章",
    "よみ": "たかみね あきら",
    "X（旧Twitter）": null,
    "所属": "無所属"
  },
  {
    "氏名": "大川　元",
    "登録名": "大川　元",
    "よみ": "おおかわ はじめ",
    "X（旧Twitter）": "https://x.com/hajime1826",
    "所属": "無所属"
  },
  {
    "氏名": "中間　建二",
    "登録名": "中間　建二",
    "よみ": "なかま けんじ",
    "X（旧Twitter）": "https://x.com/minnanonakama",
    "所属": "公明党"
  },
  {
    "氏名": "荒幡　伸一",
    "登録名": "荒幡　伸一",
    "よみ": "あらはた しんいち",
    "X（旧Twitter）": null,
    "所属": "公明党"
  },
  {
    "氏名": "木戸岡　秀彦",
    "登録名": "木戸岡　秀彦",
    "よみ": "きどおか ひでひこ",
    "X（旧Twitter）": null,
    "所属": "公明党"
  },
  {
    "氏名": "佐竹　康彦",
    "登録名": "佐竹　康彦",
    "よみ": "さたけ やすひこ",
    "X（旧Twitter）": null,
    "所属": "公明党"
  },
  {
    "氏名": "東口　正美",
    "登録名": "東口　正美",
    "よみ": "ひがしぐち まさみ",
    "X（旧Twitter）": null,
    "所属": "公明党"
  },
  {
    "氏名": "金井　康哲",
    "登録名": "金井　康哲",
    "よみ": "かない やすのり",
    "X（旧Twitter）": null,
    "所属": "やまとみどり"
  },
  {
    "氏名": "床鍋　義博",
    "登録名": "床鍋　義博",
    "よみ": "とこなべ よしひろ",
    "X（旧Twitter）": null,
    "所属": "やまとみどり"
  },
  {
    "氏名": "中野　志乃夫",
    "登録名": "中野　志乃夫",
    "よみ": "なかの しのぶ",
    "X（旧Twitter）": null,
    "所属": "やまとみどり"
  }
]