[
  {
    "氏名": "中野　芳則",
    "登録名": "中野　芳則",
    "よみ": "なかの よしのり",
    "X（旧Twitter）": null,
    "所属": "自民クラブ"
  },
  {
    "氏名": "山田　紀之",
    "登録名": "山田　紀之",
    "よみ": "やまだ のりゆき",
    "X（旧Twitter）": null,
    "所属": "自民クラブ"
  },
  {
    "氏名": "寺島　和成",
    "登録名": "寺島　和成",
    "よみ": "てらしま かずなり",
    "X（旧Twitter）": null,
    "所属": "自民クラブ"
  },
  {
    "氏名": "山﨑　哲男",
    "登録名": "山﨑　哲男",
    "よみ": "やまざき てつお",
    "X（旧Twitter）": null,
    "所属": "自民クラブ"
  },
  {
    "氏名": "阿部　悦博",
    "登録名": "阿部　悦博",
    "よみ": "あべ よしひろ",
    "X（旧Twitter）": null,
    "所属": "自民クラブ"
  },
  {
    "氏名": "迫田　晃樹",
    "登録名": "迫田　晃樹",
    "よみ": "さこだ こうき",
    "X（旧Twitter）": null,
    "所属": "自民クラブ"
  },
  {
    "氏名": "山田　敏夫",
    "登録名": "山田　敏夫",
    "よみ": "やまだ としお",
    "X（旧Twitter）": null,
    "所属": "自民クラブ"
  },
  {
    "氏名": "島﨑　実",
    "登録名": "島﨑　実",
    "よみ": "しまざき みのる",
    "X（旧Twitter）": null,
    "所属": "自民クラブ"
  },
  {
    "氏名": "山﨑　勝",
    "登録名": "山﨑　勝",
    "よみ": "やまざき まさる",
    "X（旧Twitter）": null,
    "所属": "自民クラブ"
  },
  {
    "氏名": "鴨居　たかやす",
    "登録名": "鴨居　たかやす",
    "よみ": "かもい たかやす",
    "X（旧Twitter）": null,
    "所属": "自民クラブ"
  },
  {
    "氏名": "久保　富弘",
    "登録名": "久保　富弘",
    "よみ": "くぼ とみひろ",
    "X（旧Twitter）": null,
    "所属": "自民クラブ"
  },
  {
    "氏名": "井上　たかし",
    "登録名": "井上　たかし",
    "よみ": "いのうえ たかし",
    "X（旧Twitter）": "https://x.com/inoue_9",
    "所属": "日本共産党"
  },
  {
    "氏名": "みねざき　拓実",
    "登録名": "みねざき　拓実",
    "よみ": "みねざき たくみ",
    "X（旧Twitter）": null,
    "所属": "日本共産党"
  },
  {
    "氏名": "藤野　ひろえ",
    "登録名": "藤野　ひろえ",
    "よみ": "ふじの ひろえ",
    "X（旧Twitter）": null,
    "所属": "日本共産党"
  },
  {
    "氏名": "長谷川　真弓",
    "登録名": "長谷川　真弓",
    "よみ": "はせがわ まゆみ",
    "X（旧Twitter）": null,
    "所属": "公明党"
  },
  {
    "氏名": "湖城　宣子",
    "登録名": "湖城　宣子",
    "よみ": "こじょう のぶこ",
    "X（旧Twitter）": null,
    "所属": "公明党"
  },
  {
    "氏名": "山内　公美子",
    "登録名": "山内　公美子",
    "よみ": "やまのうち くみこ",
    "X（旧Twitter）": null,
    "所属": "公明党"
  },
  {
    "氏名": "鴻井　伸二",
    "登録名": "鴻井　伸二",
    "よみ": "こうい しんじ",
    "X（旧Twitter）": null,
    "所属": "公明党"
  },
  {
    "氏名": "野島　資雄",
    "登録名": "野島　資雄",
    "よみ": "のじま としお",
    "X（旧Twitter）": null,
    "所属": "公明党"
  },
  {
    "氏名": "茂木　亮輔",
    "登録名": "茂木　亮輔",
    "よみ": "もぎ りょうすけ",
    "X（旧Twitter）": "https://x.com/Ryosukemogi2668",
    "所属": "日本維新の会"
  },
  {
    "氏名": "ぬのや　和代",
    "登録名": "ぬのや　和代",
    "よみ": "ぬのや かずよ",
    "X（旧Twitter）": null,
    "所属": "市民フォーラム青梅・都民ファースト"
  },
  {
    "氏名": "新井　啓司",
    "登録名": "新井　啓司",
    "よみ": "あらい けいし",
    "X（旧Twitter）": null,
    "所属": "市民フォーラム青梅・都民ファースト"
  },
  {
    "氏名": "野﨑　充孝",
    "登録名": "野﨑　充孝",
    "よみ": "のざき みつたか",
    "X（旧Twitter）": null,
    "所属": "立憲民主党"
  },
  {
    "氏名": "千葉　ひろみ",
    "登録名": "千葉　ひろみ",
    "よみ": "ちば ひろみ",
    "X（旧Twitter）": null,
    "所属": "立憲民主党"
  }
]