[
  {
    "氏名": "秋田　しづか",
    "登録名": "秋田　しづか",
    "よみ": "あきた　しづか",
    "X（旧Twitter）": "https://x.com/machidalabo_sa",
    "所属": "諸派"
  },
  {
    "氏名": "渡辺　さとし",
    "登録名": "渡辺　さとし",
    "よみ": "わたなべ　さとし",
    "X（旧Twitter）": null,
    "所属": "まちだ市民クラブ"
  },
  {
    "氏名": "小野　りゅうじ",
    "登録名": "小野　りゅうじ",
    "よみ": "おの　りゅうじ",
    "X（旧Twitter）": "https://x.com/ono_ryuuji",
    "所属": "まちだ市民クラブ"
  },
  {
    "氏名": "笹倉　みどり",
    "登録名": "笹倉　みどり",
    "よみ": "ささくら　みどり",
    "X（旧Twitter）": null,
    "所属": "まちだ市民クラブ"
  },
  {
    "氏名": "小野寺　まなぶ",
    "登録名": "小野寺　まなぶ",
    "よみ": "おのでら　まなぶ",
    "X（旧Twitter）": "https://twitter.com/manabu_onodera",
    "所属": "公明党"
  },
  {
    "氏名": "木目田　英男",
    "登録名": "木目田　英男",
    "よみ": "きめだ　ひでお",
    "X（旧Twitter）": "https://x.com/kimedahideo1",
    "所属": "選ばれる町田をつくる会"
  },
  {
    "氏名": "中川　幸太郎",
    "登録名": "中川　幸太郎",
    "よみ": "なかがわ　こうたろう",
    "X（旧Twitter）": "https://x.com/quarter_law",
    "所属": "諸派"
  },
  {
    "氏名": "矢口　まゆ",
    "登録名": "矢口　まゆ",
    "よみ": "やぐち　まゆ",
    "X（旧Twitter）": "https://twitter.com/machida_mayuyu",
    "所属": "諸派"
  },
  {
    "氏名": "加藤　真彦",
    "登録名": "加藤　真彦",
    "よみ": "かとう　まさひこ",
    "X（旧Twitter）": null,
    "所属": "自由民主党"
  },
  {
    "氏名": "石川　好忠",
    "登録名": "石川　好忠",
    "よみ": "いしかわ　よしただ",
    "X（旧Twitter）": null,
    "所属": "自由民主党"
  },
  {
    "氏名": "佐藤　和彦",
    "登録名": "佐藤　和彦",
    "よみ": "さとう　かずひこ",
    "X（旧Twitter）": null,
    "所属": "まちだ市民クラブ"
  },
  {
    "氏名": "森本　せいや",
    "登録名": "森本　せいや",
    "よみ": "もりもと　せいや",
    "X（旧Twitter）": "https://x.com/seiya_morimoto",
    "所属": "まちだ市民クラブ"
  },
  {
    "氏名": "松岡　みゆき",
    "登録名": "松岡　みゆき",
    "よみ": "まつおか　みゆき",
    "X（旧Twitter）": null,
    "所属": "無所属"
  },
  {
    "氏名": "おんじょう　由久",
    "登録名": "おんじょう　由久",
    "よみ": "おんじょう　よしひさ",
    "X（旧Twitter）": null,
    "所属": "公明党"
  },
  {
    "氏名": "松葉　ひろみ",
    "登録名": "松葉　ひろみ",
    "よみ": "まつば　ひろみ",
    "X（旧Twitter）": null,
    "所属": "公明党"
  },
  {
    "氏名": "白川　哲也",
    "登録名": "白川　哲也",
    "よみ": "しらかわ　てつや",
    "X（旧Twitter）": "https://x.com/shirakawa_",
    "所属": "選ばれる町田をつくる会"
  },
  {
    "氏名": "いわせ　和子",
    "登録名": "いわせ　和子",
    "よみ": "いわせ　かずこ",
    "X（旧Twitter）": null,
    "所属": "選ばれる町田をつくる会"
  },
  {
    "氏名": "田中　美穂",
    "登録名": "田中　美穂",
    "よみ": "たなか　みほ",
    "X（旧Twitter）": "https://x.com/mihot_n_k_",
    "所属": "日本共産党"
  },
  {
    "氏名": "佐々木　智子",
    "登録名": "佐々木　智子",
    "よみ": "ささき　ともこ",
    "X（旧Twitter）": "https://x.com/sasakitomoko_",
    "所属": "日本共産党"
  },
  {
    "氏名": "おぜき　重太郎",
    "登録名": "おぜき　重太郎",
    "よみ": "おぜき　じゅうたろう",
    "X（旧Twitter）": null,
    "所属": "諸派"
  },
  {
    "氏名": "三遊亭　らん丈",
    "登録名": "三遊亭　らん丈",
    "よみ": "さんゆうてい　らんじょう",
    "X（旧Twitter）": "https://x.com/s_ranjo",
    "所属": "自由民主党"
  },
  {
    "氏名": "戸塚　正人",
    "登録名": "戸塚　正人",
    "よみ": "とつか　まさと",
    "X（旧Twitter）": null,
    "所属": "まちだ市民クラブ"
  },
  {
    "氏名": "今村　るか",
    "登録名": "今村　るか",
    "よみ": "いまむら　るか",
    "X（旧Twitter）": "https://x.com/rukarukainfo",
    "所属": "まちだ市民クラブ"
  },
  {
    "氏名": "新井　よしなお",
    "登録名": "新井　よしなお",
    "よみ": "あらい　よしなお",
    "X（旧Twitter）": "https://x.com/Y_Arai_Machida",
    "所属": "無所属"
  },
  {
    "氏名": "吉田　つとむ",
    "登録名": "吉田　つとむ",
    "よみ": "よしだ　つとむ",
    "X（旧Twitter）": "https://x.com/yoshidaben",
    "所属": "無所属"
  },
  {
    "氏名": "山下　てつや",
    "登録名": "山下　てつや",
    "よみ": "やました　てつや",
    "X（旧Twitter）": "https://x.com/Tetsuyadeganba",
    "所属": "公明党"
  },
  {
    "氏名": "おく　栄一",
    "登録名": "おく　栄一",
    "よみ": "おく　えいいち",
    "X（旧Twitter）": null,
    "所属": "公明党"
  },
  {
    "氏名": "若林　章喜",
    "登録名": "若林　章喜",
    "よみ": "わかばやし　あきよし",
    "X（旧Twitter）": null,
    "所属": "選ばれる町田をつくる会"
  },
  {
    "氏名": "熊沢　あやり",
    "登録名": "熊沢　あやり",
    "よみ": "くまざわ　あやり",
    "X（旧Twitter）": null,
    "所属": "諸派"
  },
  {
    "氏名": "細野　龍子",
    "登録名": "細野　龍子",
    "よみ": "ほその　りゅうこ",
    "X（旧Twitter）": null,
    "所属": "日本共産党"
  },
  {
    "氏名": "殿村　健一",
    "登録名": "殿村　健一",
    "よみ": "とのむら　 けんいち",
    "X（旧Twitter）": null,
    "所属": "日本共産党"
  },
  {
    "氏名": "藤田　学",
    "登録名": "藤田　学",
    "よみ": "ふじた　がく",
    "X（旧Twitter）": "https://x.com/gaku24h",
    "所属": "自由民主党"
  },
  {
    "氏名": "佐藤　伸一郎",
    "登録名": "佐藤　伸一郎",
    "よみ": "さとう　しんいちろう",
    "X（旧Twitter）": null,
    "所属": "自由民主党"
  }
]