[
  {
    "氏名": "虻川　浩",
    "登録名": "虻川　浩",
    "よみ": "あぶかわ ひろし",
    "X（旧Twitter）": "https://x.com/abusan1118",
    "所属": "市議会公明党"
  },
  {
    "氏名": "石津　はるか",
    "登録名": "石津　はるか",
    "よみ": "いしづ はるか",
    "X（旧Twitter）": "https://x.com/Haruka_Ishizu",
    "所属": "一人会派と維新の会"
  },
  {
    "氏名": "伊藤　央",
    "登録名": "伊藤　央",
    "よみ": "いとう ひさし",
    "X（旧Twitter）": "https://x.com/hisashi_sprout",
    "所属": "一人会派と維新の会"
  },
  {
    "氏名": "岩本　誠",
    "登録名": "岩本　誠",
    "よみ": "いわもと まこと",
    "X（旧Twitter）": "https://x.com/kodairaiwamoto",
    "所属": "フォーラム小平"
  },
  {
    "氏名": "岡田　しんぺい",
    "登録名": "岡田　しんぺい",
    "よみ": "おかだ しんぺい",
    "X（旧Twitter）": "https://x.com/shimpeiokada",
    "所属": "フォーラム小平"
  },
  {
    "氏名": "川里　富美",
    "登録名": "川里　富美",
    "よみ": "かわさと ふみ",
    "X（旧Twitter）": "https://x.com/fmifmilion",
    "所属": "フォーラム小平"
  },
  {
    "氏名": "さとう　悦子",
    "登録名": "さとう　悦子",
    "よみ": "さとう えつこ",
    "X（旧Twitter）": null,
    "所属": "生活者ネットワーク"
  },
  {
    "氏名": "佐藤　徹",
    "登録名": "佐藤　徹",
    "よみ": "さとう とおる",
    "X（旧Twitter）": "https://x.com/yyhpbg04dwhhhby",
    "所属": "市議会公明党"
  },
  {
    "氏名": "柴尾　ひろみ",
    "登録名": "柴尾　ひろみ",
    "よみ": "しばお ひろみ",
    "X（旧Twitter）": null,
    "所属": "生活者ネットワーク"
  },
  {
    "氏名": "鈴木　だいち",
    "登録名": "鈴木　だいち",
    "よみ": "すずき だいち",
    "X（旧Twitter）": "https://x.com/kodairadaichi",
    "所属": "日本共産党小平市議団"
  },
  {
    "氏名": "鈴木　洋一",
    "登録名": "鈴木　洋一",
    "よみ": "すずき よういち",
    "X（旧Twitter）": null,
    "所属": "自民党小平政和会"
  },
  {
    "氏名": "髙橋　政美",
    "登録名": "髙橋　政美",
    "よみ": "たかはし まさみ",
    "X（旧Twitter）": "https://x.com/DtUe7q",
    "所属": "市議会公明党"
  },
  {
    "氏名": "津本　裕子",
    "登録名": "津本　裕子",
    "よみ": "つもと ゆうこ",
    "X（旧Twitter）": null,
    "所属": "市議会公明党"
  },
  {
    "氏名": "外山　まなみ",
    "登録名": "外山　まなみ",
    "よみ": "とやま まなみ",
    "X（旧Twitter）": "https://x.com/mtoyama0131",
    "所属": "自民党小平政和会"
  },
  {
    "氏名": "中江　美和",
    "登録名": "中江　美和",
    "よみ": "なかえ みわ",
    "X（旧Twitter）": "https://x.com/nakaemiwa",
    "所属": "フォーラム小平"
  },
  {
    "氏名": "中倉　茂和",
    "登録名": "中倉　茂和",
    "よみ": "なかくら しげかず",
    "X（旧Twitter）": "https://x.com/nakamowa",
    "所属": "無会派（市議会れいわ新選組）"
  },
  {
    "氏名": "橋本　孝二",
    "登録名": "橋本　孝二",
    "よみ": "はしもと こうじ",
    "X（旧Twitter）": null,
    "所属": "市議会公明党"
  },
  {
    "氏名": "比留間　洋一",
    "登録名": "比留間　洋一",
    "よみ": "ひるま よういち",
    "X（旧Twitter）": "https://x.com/qju910",
    "所属": "自民党小平政和会"
  },
  {
    "氏名": "深谷　幸信",
    "登録名": "深谷　幸信",
    "よみ": "ふかや ゆきのぶ",
    "X（旧Twitter）": "https://x.com/fukaya_yukky",
    "所属": "自民党小平政和会"
  },
  {
    "氏名": "福室　英俊",
    "登録名": "福室　英俊",
    "よみ": "ふくむろ ひでとし",
    "X（旧Twitter）": "https://x.com/hqzydmbr5p5prgy",
    "所属": "自民党小平政和会"
  },
  {
    "氏名": "細谷　正",
    "登録名": "細谷　正",
    "よみ": "ほそや ただし",
    "X（旧Twitter）": null,
    "所属": "日本共産党小平市議団"
  },
  {
    "氏名": "水口　かずえ",
    "登録名": "水口　かずえ",
    "よみ": "みずぐち かずえ",
    "X（旧Twitter）": "https://x.com/mizuguchikazue",
    "所属": "無会派（まちづくり市民こだいら）"
  },
  {
    "氏名": "三輪　博美",
    "登録名": "三輪　博美",
    "よみ": "みわ ひろみ",
    "X（旧Twitter）": "https://x.com/piromi1982",
    "所属": "日本共産党小平市議団"
  },
  {
    "氏名": "安竹　洋平",
    "登録名": "安竹　洋平",
    "よみ": "やすたけ ようへい",
    "X（旧Twitter）": "https://x.com/yasutakeyohei",
    "所属": "一人会派と維新の会"
  },
  {
    "氏名": "山田　大輔",
    "登録名": "山田　大輔",
    "よみ": "やまだ だいすけ",
    "X（旧Twitter）": "https://x.com/KODAIRA_DAISUKI",
    "所属": "自民党小平政和会"
  },
  {
    "氏名": "幸田　昌之",
    "登録名": "幸田　昌之",
    "よみ": "ゆきた まさゆき",
    "X（旧Twitter）": null,
    "所属": "市議会公明党"
  },
  {
    "氏名": "吉本　ゆうすけ",
    "登録名": "吉本　ゆうすけ",
    "よみ": "よしもと ゆうすけ",
    "X（旧Twitter）": "https://x.com/TP5wYSBtGoLaOrx",
    "所属": "フォーラム小平"
  }
]
