[
  {
    "氏名": "栗本真一",
    "登録名": "栗本真一",
    "よみ": "くりもとしんいち",
    "X（旧Twitter）": null,
    "所属": "無所属"
  },
  {
    "氏名": "栗本道雄",
    "登録名": "栗本道雄",
    "よみ": "くりもとみちお",
    "X（旧Twitter）": null,
    "所属": "無所属"
  },
  {
    "氏名": "黒田正道",
    "登録名": "黒田正道",
    "よみ": "くろだまさみち",
    "X（旧Twitter）": null,
    "所属": "無所属"
  },
  {
    "氏名": "砂原奈美子",
    "登録名": "砂原奈美子",
    "よみ": "すなはらなみこ",
    "X（旧Twitter）": null,
    "所属": "無所属"
  },
  {
    "氏名": "西川理恵",
    "登録名": "西川理恵",
    "よみ": "にしかわりえ",
    "X（旧Twitter）": null,
    "所属": "無所属"
  },
  {
    "氏名": "広瀬旭治",
    "登録名": "広瀬旭治",
    "よみ": "ひろせきょうじ",
    "X（旧Twitter）": null,
    "所属": "無所属"
  }
]