[
  {
    "氏名": "ひらい　里美",
    "登録名": "ひらい　里美",
    "よみ": "ひらい　さとみ",
    "X（旧Twitter）": null,
    "所属": "無会派"
  },
  {
    "氏名": "高木　さとこ",
    "登録名": "高木　さとこ",
    "よみ": "たかぎ　さとこ",
    "X（旧Twitter）": null,
    "所属": "無会派"
  },
  {
    "氏名": "吉野　芳子",
    "登録名": "吉野　芳子",
    "よみ": "よしの　よしこ",
    "X（旧Twitter）": null,
    "所属": "無会派"
  },
  {
    "氏名": "きたみ　まさし",
    "登録名": "きたみ　まさし",
    "よみ": "きたみ　まさし",
    "X（旧Twitter）": null,
    "所属": "分かりやすい政治を伝える・維新の会"
  },
  {
    "氏名": "三宅　まこと",
    "登録名": "三宅　まこと",
    "よみ": "みやけ　まこと",
    "X（旧Twitter）": "https://x.com/miyake_makoto64",
    "所属": "分かりやすい政治を伝える・維新の会"
  },
  {
    "氏名": "三角　武久",
    "登録名": "三角　武久",
    "よみ": "みすみ　たけひさ",
    "X（旧Twitter）": null,
    "所属": "自由民主党・明政クラブ"
  },
  {
    "氏名": "小木　哲朗",
    "登録名": "小木　哲朗",
    "よみ": "おぎ　てつろう",
    "X（旧Twitter）": null,
    "所属": "自由民主党・明政クラブ"
  },
  {
    "氏名": "山田　みちこ",
    "登録名": "山田　みちこ",
    "よみ": "やまだ　みちこ",
    "X（旧Twitter）": null,
    "所属": "自由民主党・明政クラブ"
  },
  {
    "氏名": "しの　浩司",
    "登録名": "しの　浩司",
    "よみ": "しの　こうじ",
    "X（旧Twitter）": null,
    "所属": "自由民主党・明政クラブ"
  },
  {
    "氏名": "太田　久美子",
    "登録名": "太田　久美子",
    "よみ": "おおた　くみこ",
    "X（旧Twitter）": null,
    "所属": "自由民主党・明政クラブ"
  },
  {
    "氏名": "荒木　てつ",
    "登録名": "荒木　てつ",
    "よみ": "あらき　てつ",
    "X（旧Twitter）": null,
    "所属": "日本共産党狛江市議団"
  },
  {
    "氏名": "岡村　しん",
    "登録名": "岡村　しん",
    "よみ": "おかむら　しん",
    "X（旧Twitter）": null,
    "所属": "日本共産党狛江市議団"
  },
  {
    "氏名": "宮坂　良子",
    "登録名": "宮坂　良子",
    "よみ": "みやさか　よしこ",
    "X（旧Twitter）": null,
    "所属": "日本共産党狛江市議団"
  },
  {
    "氏名": "西村　あつ子",
    "登録名": "西村　あつ子",
    "よみ": "にしむら　あつこ",
    "X（旧Twitter）": null,
    "所属": "日本共産党狛江市議団"
  },
  {
    "氏名": "小野寺　克己",
    "登録名": "小野寺　克己",
    "よみ": "おのでら　かつき",
    "X（旧Twitter）": null,
    "所属": "狛江市議会公明党"
  },
  {
    "氏名": "石川　和広",
    "登録名": "石川　和広",
    "よみ": "いしかわ　かずひろ",
    "X（旧Twitter）": null,
    "所属": "狛江市議会公明党"
  },
  {
    "氏名": "山田　幸子",
    "登録名": "山田　幸子",
    "よみ": "やまだ　さちこ",
    "X（旧Twitter）": null,
    "所属": "狛江市議会公明党"
  },
  {
    "氏名": "佐々木　貴史",
    "登録名": "佐々木　貴史",
    "よみ": "ささき　たかし",
    "X（旧Twitter）": null,
    "所属": "狛江市議会公明党"
  },
  {
    "氏名": "辻村　ともこ",
    "登録名": "辻村　ともこ",
    "よみ": "つじむら　ともこ",
    "X（旧Twitter）": "https://x.com/tomokotsujimura",
    "所属": "自由民主党・明政クラブ"
  },
  {
    "氏名": "谷田部　かずゆき",
    "登録名": "谷田部　かずゆき",
    "よみ": "やたべ　かずゆき",
    "X（旧Twitter）": null,
    "所属": "自由民主党・明政クラブ"
  },
  {
    "氏名": "栗山　欽行",
    "登録名": "栗山　欽行",
    "よみ": "くりやま　よしゆき",
    "X（旧Twitter）": null,
    "所属": "自由民主党・明政クラブ"
  },
  {
    "氏名": "石井　功",
    "登録名": "石井　功",
    "よみ": "いしい　いさお",
    "X（旧Twitter）": null,
    "所属": "自由民主党・明政クラブ"
  }
]