[
  {
    "氏名": "成田　ちひろ",
    "登録名": "成田　ちひろ",
    "よみ": "なりた ちひろ",
    "X（旧Twitter）": null,
    "所属": "未確認"
  },
  {
    "氏名": "加藤　こうじ",
    "登録名": "加藤　こうじ",
    "よみ": "かとう こうじ",
    "X（旧Twitter）": "https://x.com/katokoji0716",
    "所属": "自由民主党"
  },
  {
    "氏名": "山田　さとみ",
    "登録名": "山田　さとみ",
    "よみ": "やまだ さとみ",
    "X（旧Twitter）": null,
    "所属": "都民ファーストの会"
  },
  {
    "氏名": "池田　ゆうや",
    "登録名": "池田　ゆうや",
    "よみ": "いけだ ゆうや",
    "X（旧Twitter）": "https://x.com/yuyaikeda_mtk",
    "所属": "自由民主党"
  },
  {
    "氏名": "石井　れいこ",
    "登録名": "石井　れいこ",
    "よみ": "いしい れいこ",
    "X（旧Twitter）": "https://x.com/ishii_reiko_",
    "所属": "れいわ新選組"
  },
  {
    "氏名": "前田　まい",
    "登録名": "前田　まい",
    "よみ": "まえだ まい",
    "X（旧Twitter）": null,
    "所属": "未確認"
  },
  {
    "氏名": "半田　伸明",
    "登録名": "半田　伸明",
    "よみ": "はんだ のぶあき",
    "X（旧Twitter）": "https://x.com/handa_nobuaki",
    "所属": "未確認"
  },
  {
    "氏名": "伊藤　俊明",
    "登録名": "伊藤　俊明",
    "よみ": "いとう としあき",
    "X（旧Twitter）": null,
    "所属": "自由民主党"
  },
  {
    "氏名": "野村　羊子",
    "登録名": "野村　羊子",
    "よみ": "のむら ようこ",
    "X（旧Twitter）": "https://x.com/hitujinomura",
    "所属": "未確認"
  },
  {
    "氏名": "谷口　としや",
    "登録名": "谷口　としや",
    "よみ": "たにぐち としや",
    "X（旧Twitter）": null,
    "所属": "未確認"
  },
  {
    "氏名": "紫野　あすか",
    "登録名": "紫野　あすか",
    "よみ": "しの あすか",
    "X（旧Twitter）": null,
    "所属": "日本共産党"
  },
  {
    "氏名": "土屋　けんいち",
    "登録名": "土屋　けんいち",
    "よみ": "つちや けんいち",
    "X（旧Twitter）": null,
    "所属": "未確認"
  },
  {
    "氏名": "小幡　和仁",
    "登録名": "小幡　和仁",
    "よみ": "おばた かずひと",
    "X（旧Twitter）": null,
    "所属": "立憲民主党"
  },
  {
    "氏名": "原　めぐみ",
    "登録名": "原　めぐみ",
    "よみ": "はら めぐみ",
    "X（旧Twitter）": null,
    "所属": "都民ファーストの会"
  },
  {
    "氏名": "岩見　大三",
    "登録名": "岩見　大三",
    "よみ": "いわみ だいぞう",
    "X（旧Twitter）": null,
    "所属": "日本共産党"
  },
  {
    "氏名": "大倉　あき子",
    "登録名": "大倉　あき子",
    "よみ": "おおくら あきこ",
    "X（旧Twitter）": null,
    "所属": "公明党"
  },
  {
    "氏名": "佐々木　かずよ",
    "登録名": "佐々木　かずよ",
    "よみ": "ささき かずよ",
    "X（旧Twitter）": null,
    "所属": "未確認"
  },
  {
    "氏名": "大城　みゆき",
    "登録名": "大城　みゆき",
    "よみ": "おおしろ みゆき",
    "X（旧Twitter）": null,
    "所属": "日本共産党"
  },
  {
    "氏名": "粕谷　みのる",
    "登録名": "粕谷　みのる",
    "よみ": "かすや みのる",
    "X（旧Twitter）": null,
    "所属": "公明党"
  },
  {
    "氏名": "赤松　だいいち",
    "登録名": "赤松　だいいち",
    "よみ": "あかまつ だいいち",
    "X（旧Twitter）": null,
    "所属": "公明党"
  },
  {
    "氏名": "吉田　まさとし",
    "登録名": "吉田　まさとし",
    "よみ": "よしだ まさとし",
    "X（旧Twitter）": null,
    "所属": "自由民主党"
  },
  {
    "氏名": "えびさわ　せいご",
    "登録名": "えびさわ　せいご",
    "よみ": "えびさわ せいご",
    "X（旧Twitter）": null,
    "所属": "未確認"
  },
  {
    "氏名": "吉野　けんさく",
    "登録名": "吉野　けんさく",
    "よみ": "よしの けんさく",
    "X（旧Twitter）": null,
    "所属": "無所属"
  },
  {
    "氏名": "中泉　きよし",
    "登録名": "中泉　きよし",
    "よみ": "なかいずみ きよし",
    "X（旧Twitter）": null,
    "所属": "公明党"
  },
  {
    "氏名": "栗原　けんじ",
    "登録名": "栗原　けんじ",
    "よみ": "くりはら けんじ",
    "X（旧Twitter）": null,
    "所属": "日本共産党"
  },
  {
    "氏名": "伊沢　けい子",
    "登録名": "伊沢　けい子",
    "よみ": "いざわ けいこ",
    "X（旧Twitter）": null,
    "所属": "自由民主党"
  },
  {
    "氏名": "太田　みつ子",
    "登録名": "太田　みつ子",
    "よみ": "おおた みつこ",
    "X（旧Twitter）": null,
    "所属": "自由民主党"
  },
  {
    "氏名": "高谷　真一朗",
    "登録名": "高谷　真一朗",
    "よみ": "たかや しんいちろう",
    "X（旧Twitter）": null,
    "所属": "立憲民主党"
  }
]