[
  {
    "氏名": "いそむら　あきこ",
    "登録名": "いそむら　あきこ",
    "よみ": "いそむら　あきこ",
    "X（旧Twitter）": null,
    "所属": "改革未来の会"
  },
  {
    "氏名": "榎本　久春",
    "登録名": "榎本　久春",
    "よみ": "えのもと　ひさはる",
    "X（旧Twitter）": null,
    "所属": "改革未来の会"
  },
  {
    "氏名": "武田　まさひと",
    "登録名": "武田　まさひと",
    "よみ": "たけだ　まさひと",
    "X（旧Twitter）": "https://x.com/inagitetsu",
    "所属": "無所属"
  },
  {
    "氏名": "湯谷　ひろし",
    "登録名": "湯谷　ひろし",
    "よみ": "ゆや　ひろし",
    "X（旧Twitter）": null,
    "所属": "公明党"
  },
  {
    "氏名": "佐藤　しんじ",
    "登録名": "佐藤　しんじ",
    "よみ": "さとう　しんじ",
    "X（旧Twitter）": "https://x.com/satoshin0406",
    "所属": "公明党"
  },
  {
    "氏名": "つのじ　寛美",
    "登録名": "つのじ　寛美",
    "よみ": "つのじ　ひろみ",
    "X（旧Twitter）": null,
    "所属": "公明党"
  },
  {
    "氏名": "村上　洋子",
    "登録名": "村上　洋子",
    "よみ": "むらかみ　ようこ",
    "X（旧Twitter）": null,
    "所属": "無所属"
  },
  {
    "氏名": "山岸　太一",
    "登録名": "山岸　太一",
    "よみ": "やまぎし　たいち",
    "X（旧Twitter）": null,
    "所属": "日本共産党"
  },
  {
    "氏名": "田島　きく子",
    "登録名": "田島　きく子",
    "よみ": "たじま　きくこ",
    "X（旧Twitter）": null,
    "所属": "日本共産党"
  },
  {
    "氏名": "岡田　まなぶ",
    "登録名": "岡田　まなぶ",
    "よみ": "おかだ　まなぶ",
    "X（旧Twitter）": null,
    "所属": "日本共産党"
  },
  {
    "氏名": "中島　健介",
    "登録名": "中島　健介",
    "よみ": "なかじま　けんすけ",
    "X（旧Twitter）": null,
    "所属": "稲志会"
  },
  {
    "氏名": "土居　のりひろ",
    "登録名": "土居　のりひろ",
    "よみ": "どい　のりひろ",
    "X（旧Twitter）": null,
    "所属": "稲志会"
  },
  {
    "氏名": "中田　中",
    "登録名": "中田　中",
    "よみ": "なかた　あたる",
    "X（旧Twitter）": "https://x.com/ataru3",
    "所属": "稲志会"
  },
  {
    "氏名": "坂田　たけふみ",
    "登録名": "坂田　たけふみ",
    "よみ": "さかた　たけふみ",
    "X（旧Twitter）": null,
    "所属": "新政会"
  },
  {
    "氏名": "池田　英司",
    "登録名": "池田　英司",
    "よみ": "いけだ　えいじ",
    "X（旧Twitter）": null,
    "所属": "新政会"
  },
  {
    "氏名": "渡辺　力",
    "登録名": "渡辺　力",
    "よみ": "わたなべ　ちから",
    "X（旧Twitter）": null,
    "所属": "新政会"
  },
  {
    "氏名": "角田　政信",
    "登録名": "角田　政信",
    "よみ": "かくた　まさのぶ",
    "X（旧Twitter）": null,
    "所属": "新政会"
  },
  {
    "氏名": "梶浦　みさこ",
    "登録名": "梶浦　みさこ",
    "よみ": "かじうら　みさこ",
    "X（旧Twitter）": null,
    "所属": "新政会"
  },
  {
    "氏名": "北浜　けんいち",
    "登録名": "北浜　けんいち",
    "よみ": "きたはま　けんいち",
    "X（旧Twitter）": null,
    "所属": "稲志会"
  },
  {
    "氏名": "川村　あや",
    "登録名": "川村　あや",
    "よみ": "かわむら　あや",
    "X（旧Twitter）": "https://x.com/kawamuraaya0830",
    "所属": "稲志会"
  },
  {
    "氏名": "鈴木　誠",
    "登録名": "鈴木　誠",
    "よみ": "すずき　まこと",
    "X（旧Twitter）": null,
    "所属": "稲志会"
  },
  {
    "氏名": "岩佐　ゆきひろ",
    "登録名": "岩佐　ゆきひろ",
    "よみ": "いわさ　ゆきひろ",
    "X（旧Twitter）": null,
    "所属": "無所属"
  }
]