[
  {
    "氏名": "小林　正吾郎",
    "登録名": "小林　正吾郎",
    "よみ": "こばやし　しょうごろう",
    "X（旧Twitter）": null,
    "所属": "無所属"
  },
  {
    "氏名": "関　真樹",
    "登録名": "関　真樹",
    "よみ": "せき　まさき",
    "X（旧Twitter）": null,
    "所属": "無所属"
  },
  {
    "氏名": "鈴木　佑典",
    "登録名": "鈴木　佑典",
    "よみ": "すずき　ゆうすけ",
    "X（旧Twitter）": null,
    "所属": "無所属"
  },
  {
    "氏名": "松本　裕一",
    "登録名": "松本　裕一",
    "よみ": "まつもと　ひろかず",
    "X（旧Twitter）": null,
    "所属": "無所属"
  },
  {
    "氏名": "鈴木　国忠",
    "登録名": "鈴木　国忠",
    "よみ": "すずき　くにただ",
    "X（旧Twitter）": null,
    "所属": "無所属"
  },
  {
    "氏名": "浜川　芳光",
    "登録名": "浜川　芳光",
    "よみ": "はまかわ　よしみつ",
    "X（旧Twitter）": null,
    "所属": "無所属"
  },
  {
    "氏名": "清水　勝彦",
    "登録名": "清水　勝彦",
    "よみ": "しみず　かつひこ",
    "X（旧Twitter）": null,
    "所属": "無所属"
  },
  {
    "氏名": "清水　勉",
    "登録名": "清水　勉",
    "よみ": "しみず　つとむ",
    "X（旧Twitter）": null,
    "所属": "無所属"
  }
]