[
  {
    "氏名": "松岡　賢二",
    "登録名": "松岡　賢二",
    "よみ": "まつおか　けんじ",
    "X（旧Twitter）": null,
    "所属": "無所属"
  },
  {
    "氏名": "山嵜　源重",
    "登録名": "山嵜　源重",
    "よみ": "やまざき　げんじゅう",
    "X（旧Twitter）": null,
    "所属": "自由民主党檜原新政会"
  },
  {
    "氏名": "嶋﨑　佐有理",
    "登録名": "嶋﨑　佐有理",
    "よみ": "しまざき　さゆり",
    "X（旧Twitter）": null,
    "所属": "無所属"
  },
  {
    "氏名": "野村　雅巳",
    "登録名": "野村　雅巳",
    "よみ": "のむら　まさみ",
    "X（旧Twitter）": null,
    "所属": "自由民主党檜原新政会"
  },
  {
    "氏名": "田中　惣一",
    "登録名": "田中　惣一",
    "よみ": "たなか　そういち",
    "X（旧Twitter）": null,
    "所属": "自由民主党檜原新政会"
  },
  {
    "氏名": "青木　亮輔",
    "登録名": "青木　亮輔",
    "よみ": "あおき　りょうすけ",
    "X（旧Twitter）": null,
    "所属": "自由民主党檜原新政会"
  },
  {
    "氏名": "中村　賢次",
    "登録名": "中村　賢次",
    "よみ": "なかむら　けんじ",
    "X（旧Twitter）": null,
    "所属": "けやきの会"
  },
  {
    "氏名": "峰岸　茂",
    "登録名": "峰岸　茂",
    "よみ": "みねぎし　しげる",
    "X（旧Twitter）": null,
    "所属": "自由民主党檜原新政会"
  }
]