[
  {
    "氏名": "池田望",
    "登録名": "池田望",
    "よみ": "いけだのぞむ",
    "X（旧Twitter）": null,
    "所属": "無所属"
  },
  {
    "氏名": "稲垣勇",
    "登録名": "稲垣勇",
    "よみ": "いながきいさむ",
    "X（旧Twitter）": null,
    "所属": "無所属"
  },
  {
    "氏名": "杉田一男",
    "登録名": "杉田一男",
    "よみ": "すぎたかずお",
    "X（旧Twitter）": null,
    "所属": "無所属"
  },
  {
    "氏名": "片股敬昌",
    "登録名": "片股敬昌",
    "よみ": "かたまたのりまさ",
    "X（旧Twitter）": null,
    "所属": "無所属"
  },
  {
    "氏名": "安藤重行",
    "登録名": "安藤重行",
    "よみ": "あんどうじゅうこう",
    "X（旧Twitter）": null,
    "所属": "無所属"
  },
  {
    "氏名": "清水良一",
    "登録名": "清水良一",
    "よみ": "しみずりょういち",
    "X（旧Twitter）": null,
    "所属": "無所属"
  },
  {
    "氏名": "平野悠介",
    "登録名": "平野悠介",
    "よみ": "ひらのゆうすけ",
    "X（旧Twitter）": null,
    "所属": "無所属"
  },
  {
    "氏名": "宮城ジャイアン",
    "登録名": "宮城ジャイアン",
    "よみ": "みやぎじゃいあん",
    "X（旧Twitter）": "https://x.com/gian_farm",
    "所属": "無所属"
  }
]